Year,AVERAGE of BOD_Avg,AVERAGE of DO_Avg,,,,
KAGINA D/S OF SEWAGE DISPOSAL POINT,2.521428571,,,,,
"SUTLEJ AT 1 KM. D/S OF ZENITH, PUNJAB",2.516666667,,,,,
RIVER TUNGABHADRA AT CONFLUENCE POINT OF TUNGA AND BHADRA AT KUDLI,2.516666667,,,,,
RIVER KUPLI AT KHANDONG,2.516666667,,,,,
"RIVER BEAS AT U/S PATHANKOT, PUNJAB",2.516666667,,,,,
BRAHMANI AT KAMALANGA (TALCHER D/s),2.516666667,,,,,
BRAHMANI AT KABATABANDHA (BEFORE IMPACT OF INDUSTRIAL ACTIVITY IN KALINGANAGAR AREA),2.516666667,,,,,
WATER INTAKE PT FOR BANKURA TOWN ON RIVER DWARAKESHWAR,2.5,,,,,
"TITUR RIVER D/S OF CHALISGAON, JALGAON",2.5,,,,,
TAWI AT SHETALI LIFTING POINT NAGROTA(5KM U/S TAWI BRIDGE),2.5,,,,,
"TAWI AT JAMMU U/S, (TAWI BRIDGE )",2.5,,,,,
"SONE AT WATER INTAKE POINT BHARTIYA RAIL BIJALI CO. LTD (BRBCL) NAVINAGAR, AURANGABAD",2.5,,,,,
"SIKRAHNA AT CHANPATIYA, EAST CHAMPARAN",2.5,,,,,
"SATLUJ AT 100M D/S ,NANGAL,PUNJAB",2.5,,,,,
"SABARMATI AT GANDHINAGAR CHILODA BRIDGE, LEKAWADA, GUJARAT",2.5,,,,,
"RIVER YAMUNA AT MATHURA U/S , U.P.",2.5,,,,,
"RIVER TUIKUM RIVER, SERCHHIP",2.5,,,,,
"RIVER TUICHHUAHAN STREAM, KOLASIB",2.5,,,,,
RIVER TEESTA A/C OF RIVERS LACHENCHU AND,2.5,,,,,
RIVER SWARNREKHA BEFORE MEETING KHARKAI RIVER,2.5,,,,,
"RIVER SWAN AT DHANGLA VILLAGE, SANTOSHGARH (PUNJAB)",2.5,,,,,
"RIVER SHIVNA AT RAMGHAT, MANDSAUR",2.5,,,,,
"RIVER SARABANGA AT SALEM, D/S OF TEXTILE DYEING INDUSTRIES EFFLUENT, TAMILNADU",2.5,,,,,
RIVER RANGPO D/S DAM SITE,2.5,,,,,
RIVER RAMGANGA AT D/S KALAGARH DAM (U.K.),2.5,,,,,
"RIVER PIPLAAD DAM, BHAWANI MANDI",2.5,,,,,
"RIVER PHE WATER RESERVOIR, TAWIZO STREAM WATER, RULCHAWM VILLAGE",2.5,,,,,
"RIVER PARVATI AT NEEMKHEDI, GUNA",2.5,,,,,
"RIVER PANCHAGANGA AT SHIROL NEAR SHIROL INTAKE WELL, KOLHAPUR",2.5,,,,,
"RIVER NAKKAVAGU, BACHUGUDEM, MEDAK",2.5,,,,,
"RIVER MANJEERA - NEAR GANAPATHI SUGARS , MEDAK DIST.",2.5,,,,,
"RIVER MANDAKINI B/C ALKALNADA AT RUDRAPRAYAG,",2.5,,,,,
RIVER MAHI AT SHERKHI BRIDGESINDHROT BRIDGE-VADODARA,2.5,,,,,
"RIVER MAHANADI AFTER CONFL. OF RIVER MAND,NEAR BALPUR VILLAGE.",2.5,,,,,
RIVER LIDDER NEAR LAVENDER PARK,2.5,,,,,
"RIVER KRISHNA, PAVITHRA SANGAMAM, AFTER CONFLUENCE",2.5,,,,,
RIVER KRISHNA AFTER CONFLUENCE WITH RIVER MUSI AT VADAPALLI (V) BETWEEN A.P. and TELANGANA,2.5,,,,,
"RIVER KOYNA AT KARAD, SATARA",2.5,,,,,
RIVER KOSHALYA AT U/S PARWANOO,2.5,,,,,
"RIVER KANSI D/S OF MIDNAPORE, NEAR NEW HANUMAN MANDIR, GANDHIGHAT, MEDINIPORE(W)",2.5,,,,,
RIVER KALINADI AT U/S OF GULAOTHI TOWN IN BULANDSAHAR,2.5,,,,,
"RIVER KABINI AT SARAGUR VILLAGE D/S,",2.5,,,,,
RIVER JHELUM AT CHATTABAL WEIR (OUTLET,2.5,,,,,
RIVER JHELUM AT BARAMULLA D/S,2.5,,,,,
RIVER INDRAVATI AT NOWRANGPUR (ODISHA),2.5,,,,,
"RIVER HASDEO 100 METER DOWNSTREAM AFTER CONFLUENCE OF DENGUR NALLAH NERA C.S.E.B. EAST GUEST HOUSE, KORBA",2.5,,,,,
"RIVER GODAVARI, D/S OF RAMANUGUNDAM, MANTHANI",2.5,,,,,
"RIVER GODAVARI AT KAMALPUR U/S M/S AP RAYONS LTD. INTAKE WELL, WARANGAL",2.5,,,,,
"RIVER DHONS AT MADHUVAPUR, MADHUBANI",2.5,,,,,
RIVER DEVI AT MACCHGAON,2.5,,,,,
"RIVER CHURNI AT GADE BORDER (BANGLADESH - INDIA BORDER), NADIA, WEST BENGAL",2.5,,,,,
RIVER CHENAB D/S AT TANDI (L and S),2.5,,,,,
"RIVER CHALLUI, LENGPUI",2.5,,,,,
"RIVER CAUVERY AT KARIGHATTA NIMISHAMBA TEMPLE ROAD BRIDGE SRIRANGAPATNA,MAYDYA",2.5,,,,,
"RIVER BETWA AT U/S AT MAHUTA GHAT, AGASOD, BINA",2.5,,,,,
"RIVER BETWA AT NAYAPUR D/S MANDIDEEP INDL. AREA NO.1, DIST.RAISEN",2.5,,,,,
"RIVER BARAK AT NONEY/IJEI AT NONEY BRIDGE, NONEY",2.5,,,,,
"RIVER ALAKNANDA B/C TORIVER BHAGIRATHI AT DEVPRAYAG,",2.5,,,,,
RIVER ADYAR AT KOTTURPURAM BRIDGE,2.5,,,,,
"PURNA RIVER A/C OF MORNA, NANDURA VILLAGE",2.5,,,,,
"PURNA A/C OF MORNA, NANDURA VILLAGE",2.5,,,,,
"PENGANGA RIVER AT MEHKARBULDANA ROAD BRIDGE, MEHKAR, BULDANA",2.5,,,,,
"NARMADA NEAR PUNASA DAM, PUNASA",2.5,,,,,
NARMADA AT D/S OF VILL. JAIT,2.5,,,,,
"NARMADA AT CHANDOD, GUJARAT",2.5,,,,,
"MULA-MUTHA RIVER AT MUNDHAWA BRIDGE, MUNTHAWA,HAWELI, PUNE",2.5,,,,,
MAHANADI AT KHARAD,2.5,,,,,
"KHAGARIA ROAD BRIDGE, KHAGARIA",2.5,,,,,
HARBORA RIVER AT NARKATIAGANJ,2.5,,,,,
"GODAVARI AT NANDED, MAHARASHTRA",2.5,,,,,
"GHOD RIVER AT SHIRUR, PUNE.",2.5,,,,,
"GANGA RIVER AFTER CONFLUENCE OF RIVER SONG NEAR SATYANARAYAN TEMPLE D/S RAIWALA, DEHRADUN",2.5,,,,,
"GANGA AT HARIDWAR D/S, UPPER GANGA CANAL D/S BALKUMARI MANDIR,",2.5,,,,,
DHELLA RIVER D/S AT THAKURDWARA ALIGANJ ROAD,2.5,,,,,
CHAMBAL AT RAMESHWARGHAT NR. SAWAIMADHOPUR,2.5,,,,,
"CAUVERY RIVER D/S BARACHUKI FALLS, SATHEGALA, KOLLEGALA",2.5,,,,,
"BURHIDIHING NEAR DULIAJAN AT D/S, TINSUKIA,",2.5,,,,,
"BRAHMANI AT TALCHER U/S, ORISSA",2.5,,,,,
"BHIMA AT PUNE, D/S OF BUNDGARDEN, YERWADA, HAWELI, PUNE",2.5,,,,,
"BHIMA AT NARSINGHPUR,(D/S AF.CONFL.WITH R.NIRA)",2.5,,,,,
BEAS D/S PONG DAM,2.5,,,,,
"BEAS AT D/S CHANGARWA VILLAGE, (PUNJAB)",2.5,,,,,
ARPA D/S OF BILASPUR,2.5,,,,,
CONFLUENCE POINT OF TUNGA AND BHADRA AT KUDLI,2.49,,,,,
TAPI AT AJNAND VILLAGE,2.488333333,,,,,
"RIVER RAVI AT U/S OF MADHOPUR HEADWORKS, GURDASPUR, PUNJAB",2.483333333,,,,,
RIVER KYNSHI AT SOHIONG,2.483333333,,,,,
RIVER KONAR AT TENUGHAT DAM,2.483333333,,,,,
RIVER KANSARI AT BANAPUR ROAD NEAR PURUSHOTTAMPUR,2.483333333,,,,,
RIVER INDRAVATI AT NAWARANGPUR,2.483333333,,,,,
RIVER AMRAVATI AT 1KM D/S FROM EFF.DIS. PT. AT MADHUTHUKKULAM,2.483333333,,,,,
"KALONG RIVER AT U/S OF ANANDARAM DEKIAL PHUKAN BRIDGE, NAGAON",2.483333333,,,,,
"RIVER WARDHA AT PULGAON RAILWAY BRIDGE, VILLAGE- PULGAON,TALUKA - WARDHA, DISTRICT- WARDHA.",2.475,,,,,
RIVER SUTLEJ AT KARCHAM DRAIN,2.475,,,,,
RIVER JHELUM AT BIJEHARA,2.475,,,,,
"RIVER DISANG AT GUDAMGHAT, ASSAM",2.475,,,,,
GOMTI AT VARANASI,2.475,,,,,
"GODAVARI, D/S OF RAMANUGUNDAM, MANTHANI",2.475,,,,,
BHIMA AT PARGAON (AFTER CONFL.WITH MULE MARTHA) MAHARASHTRA.,2.475,,,,,
BAITARNI AT JAJPUR,2.47,,,,,
"RIVER SONE NEAR BHANVARSEN ROAD BRIDGE AFTER CONFLUENCE OF BANAS RIVER, DIST SIDHI",2.466666667,,,,,
RIVER MAHANADI AT CUTTACK D/S,2.466666667,,,,,
NALKARI TRIBUTARY AT PATRATU,2.466666667,,,,,
"MAHANADI AT RUDRI U/S AT DHAMTORI RESERVOIR, CHHATISGARH.",2.466666667,,,,,
IB AT BRAJARAJNAGAR (INTAKE) D/S,2.466666667,,,,,
"GODAVARI AT MANCHERIAL, A.P.",2.466666667,,,,,
"DAMODAR RIVER NEAR ZARANGDIH BRIDGE, BOKARO",2.466666667,,,,,
"CAUVERY AT PUGALUR, KARUR, TAMILNADU",2.466666667,,,,,
"RAPTI AT RAJGHAT, GORAKHPUR",2.4625,,,,,
BHEDEN RIVER BEFORE CONFLUENCE WITH IB RIVER,2.4625,,,,,
"GOMTI AT LUCKNOW D/S, U.P.",2.46,,,,,
"WAINGANGA U/S OF GAURAV PAPER MILLS, NEAR JACKWELL.",2.455,,,,,
"SINA NEAR LABOTI TOLL NAKA, LABOTI, MOHAL, SOLAPUR",2.45,,,,,
RIVER YAMUNA AT YAMUNOTRI,2.45,,,,,
"RIVER WARDHA D/S OF ACC GHUGGUS, CHANDRAPUR, CHANDRAPUR",2.45,,,,,
"RIVER WARDHA AT D/S OF ERAI RIVER AT HADASTI NEAR ARUN ENGG. WORKS, VILLAGE- HADASTI, TALUKA- CHANDRAPUR, DISTRICT- CHANDRAPUR.",2.45,,,,,
RIVER TUNGABHADRA AT KONANATHAMBIGE,2.45,,,,,
"RIVER TLAWNG RIVER, SUARPUI, BAIRABI HEPP DAM SITE, BAIRABI VILLAGE",2.45,,,,,
"RIVER TIHU (NEAR BRIDGE ALONG NH-31) TIHU, NALBARI",2.45,,,,,
RIVER SWAN D/S OF UNA AT RAMPUR BRIDGE,2.45,,,,,
"RIVER SUBARNAREKHA U/S HINDALCO IND LTD, MURLI WORKS, CHHOTAMURI, RANCHI",2.45,,,,,
RIVER RONGLI D/S DAM SITE,2.45,,,,,
RIVER RAVI AT D/S OF CHAMBA TOWN,2.45,,,,,
RIVER PUTHIMARI NEAR PUTHIMARI CHOWK AT NH CROSSING,2.45,,,,,
"RIVER POMA AT POMA,",2.45,,,,,
"RIVER PAMOHI GACHUK, PAMOHI ROAD, GUWAHATI",2.45,,,,,
RIVER KRISHNA AT VIJAYWADA TOWN,2.45,,,,,
"RIVER KRISHNA AT KSHETRA MAHULI, VILLAGE- KSHETRA-MAHULI,TALUKA- MAHULI, DISTRICT- SATARA.",2.45,,,,,
"RIVER KANHAN AT CHINDWARA BEFORE MIXING BOREGAON GROWTHCENTRE NALLA, JABALPUR",2.45,,,,,
"RIVER KANHAN AT CHINDWARA BEFORE MIXING BOREGAON GROWTH CENTRE NALLA, JABALPUR",2.45,,,,,
"RIVER GODAVARI D/S DOWLEISWARAM AFTER CONFLUENCE OF STP OUTLET, DOWLEISWARAM (V)",2.45,,,,,
"RIVER GODAVARI AT POLAVARAM, WEST GODAVARI DISTRICT",2.45,,,,,
RIVER DIBANG AT ROING (U/S),2.45,,,,,
RIVER DAMRING (KRISHNEI RIVER) AT RESUBELPARA,2.45,,,,,
RIVER CAUVERY AT WATER SUPPLY INTAKE POINT AT SHIVANSAMUDRA,2.45,,,,,
"RIVER CAUVERY AT MAHADEVPURA ROAD BRIDGE,MAYDYA",2.45,,,,,
"RIVER BHAVANI AT BHAVANI, TAMILNADU",2.45,,,,,
RIVER BARAK RIVER AT PANCHAGRAM,2.45,,,,,
"MUTHAAT KHADAKVASLA DAM, KHADAKVASLA, HAWELI, PUNE.",2.45,,,,,
"MULA AT AUNDH BDG, AUNDGAON",2.45,,,,,
MANDAKINI B/C ALAKLNADA AT RUDRAPRAYAG,2.45,,,,,
MAHANADI POWER CHANNEL D/S NEAR BURLA,2.45,,,,,
KRISHNA AT VEDADRI,2.45,,,,,
KOEL U/S (A/C OF RIVER KARO),2.45,,,,,
"KHAROON RIVER B/C KHAPRI DRAIN, DURG, RAIPUR ROAD BRIDGE, CHHATISGARH.",2.45,,,,,
"JHELUM AT DALAGATE (INLET), SRINAGAR",2.45,,,,,
"GANGA AT RAJMAHAL,",2.45,,,,,
"GANGA AT GANDHIGHAT, NIT AT PATNA",2.45,,,,,
"GANGA AT ALLAHABAD (RASOOLABAD), U.P.",2.45,,,,,
CHANDRABHAGA D/S OF PANDHARPUR TOWN,2.45,,,,,
CHAMBAL AT NAGDA D/S,2.45,,,,,
"CAUVERY AT 1KM. D/S OF BHAVANI RIVER CONFL., TAMILNADU",2.45,,,,,
BRAHMANIU/S DHARMASHALA,2.45,,,,,
BRAHMANI AT DHARMASHALA,2.45,,,,,
"BRAHMANI AT BONAIGARH, ODISHA",2.45,,,,,
BHIMA AT PUNE U/S VITHALWADI,2.45,,,,,
"BETWA AT GOVIND SAGAR, U.P",2.45,,,,,
"BASANTER U/S (R.H.S) SAMBA (BELOW NH-1A BRIDGE),",2.45,,,,,
"SIRSA RIVER, D/S NALAGARH BRIDGE",2.433333333,,,,,
RIVER LIDDER AT NUNWAN,2.433333333,,,,,
"RIVER BEAS D/S PATHANKOT, PUNJAB",2.433333333,,,,,
RIVER GOMTI AT NEEMSAR D/S,2.43,,,,,
TONS AT CHAKGHAT,2.425,,,,,
RIVER TONS AT TIUNI (HIMACHAL PRADESH/UTTRA KHAND BORDER),2.425,,,,,
RIVER KRISHNA AT U/S OF UGARKHURD BARRAGE,2.425,,,,,
"RIVER JAMMER AT DHOLABAD, RATLAM",2.425,,,,,
"RIVER GHAGHARA NEAR CHAPRA, RIVILGANJ, MANJHI, SARAN",2.425,,,,,
"RIVER GANGA AT U/S AJGABINATH MANDIR SULTANGANJ, BHAGALPUR",2.425,,,,,
"RIVER BRAHMAPUTRA AT PANDU, ASSAM",2.425,,,,,
"JUMAR RIVER AT BIT MESRA, RANCHI",2.425,,,,,
GIRNA AT JALGAON,2.425,,,,,
CAUVERY AT METTUR,2.425,,,,,
"MAHANANDA AT THAKURGANJ, KISHANGANJ ROAD BRIDGE",2.42,,,,,
RIVER NARMADA AT KHALGHAT,2.416666667,,,,,
"MANER AT SOMNAPALLI, A.P.",2.416666667,,,,,
"DAMODAR AT D/S OF IISCO AFTER 3RD OUTFALL AT DHENNA VILLAGE, WEST BENGAL",2.416666667,,,,,
CAUVERY D/S OF KR NAGAR BRIDGE,2.416666667,,,,,
RIVER BEAS D/S SUJANPUR TIHRA,2.41,,,,,
"WAINGANGA AT ASHTI, MAHARASHTRA",2.4,,,,,
"SUTLEJ AT BRIDGE HARIKE, AMRITSAR, PUNJAB",2.4,,,,,
"SIRSA AT D/S NALAGARH BRIDGE, H.P",2.4,,,,,
"SIMRAR AT KATNI NEAR ACC W/S INTAKE POINT, JABLAPUR",2.4,,,,,
SIKRAHNA RIVER AT LAURIA - HARINAGAR ROAD BRIDGE,2.4,,,,,
SERUA AT CUTTACK FD/s (SERUA) AT SANKHATRASA,2.4,,,,,
SARVARI NALLAH BEFORE CONFLUENCE TO RIVER BEAS,2.4,,,,,
"SARABANGA AT SALEM, D/S OF TEXTILE DYEING INDUSTRIES EFFLUENT",2.4,,,,,
SANKHA U/S(D/S MANDIRA DAM),2.4,,,,,
RIVER YAMUNA AT DAK PATHER (UTTARAKHAND),2.4,,,,,
"RIVER WENA AT D/S OF MOHATA MILLS, NR RD BRG ON HINGANGHAT-WADNER ROAD, HINGANGHAT, WARDHA",2.4,,,,,
"RIVER WARDHA AT U/S OF ACC LTD. GHUGGUS NEAR WCL PUMP HOUSE, VILLAGE- GHUGGUS, TALUKA- CHANDRAPUR, DISTRICT- CHANDRAPUR.",2.4,,,,,
"RIVER VENNA AT MAHABALESHWAR, VILLAGE. MAHABALESHWAR, TALUKA. MAHABALESHWAR,",2.4,,,,,
"RIVER TUIRINI RIVER, SELING",2.4,,,,,
"RIVER TLAWNG U/S, ZOBAWK VILLAGE, LUNGLEI DIST.",2.4,,,,,
RIVER THENPENNAIYAR AT CHOKKARASANAHALLI BRIDGE (BANGALORE),2.4,,,,,
"RIVER SWARNREKHA U/S HINDALCO IND LTD, MURLI WORKS, CHHOTAMURI, RANCHI",2.4,,,,,
"RIVER SUBARNAREKHA, NEAR RING ROAD BRIDGE SEMBO, NAGRI, RANCHI",2.4,,,,,
RIVER SUBARNAREKHA BEFORE MEETING KHARKAI RIVER,2.4,,,,,
"RIVER SUBARNAREKHA AT RUCCA DAM, RUCCA, RANCHI",2.4,,,,,
RIVER SUBARNAREKHA AT GHATISLA ROAD BRIDGE,2.4,,,,,
RIVER SUBARNAREKHA AFTER CONFLUENCE OF KHARKAI RIVER,2.4,,,,,
"RIVER SINGDA JHOR (TALCHER KANIHA ROAD BRIDGE, BALANGI)",2.4,,,,,
"RIVER SHIMSHA DOWNSTREAM OF MADDUR NEAR VYDYANATHESWARA TEMPLE ROAD BRIDGE,MAYDYA",2.4,,,,,
"RIVER SESSA NEAR SESSA TINIALI, NH BRIDGE, DIBRUGARH",2.4,,,,,
"RIVER SERLUI B DAM, SERLUI'B'HEPP SITE, BILKHAWTHLIR VILLAGE",2.4,,,,,
"RIVER PANCHAGANGA AT ICHALKARANJI, SHIRADWAD,HATKANANGALE,K OHLAPUR",2.4,,,,,
"RIVER NOA DIHING AT NAMSAI, (D/S OF DIHING)",2.4,,,,,
"RIVER NGENGPUI STREAM, NR KALADAN MULTI MODAL RD, LAWNGTLAI DIST.",2.4,,,,,
RIVER NARMADA AT GARUDESHWAR,2.4,,,,,
"RIVER MANAS AT NH-31 CROSSING, BARPETA DISTRICT, ASSAM",2.4,,,,,
RIVER KURWA DUMKA WATER INTAKE POINT,2.4,,,,,
RIVER KUAKHAI AT BHUBANESWAR D/S,2.4,,,,,
"RIVER KRISHNA AT DHOM DAM, VILLAGE- WAI, TALUKA- MAHABALESHWAR, DISTRICT-SATARA.",2.4,,,,,
RIVER KONAR AT KONAR DAM,2.4,,,,,
"RIVER HINDON AT SAHARANPUR D/S, AT MAHESHPUR .DEOBAND U.P.",2.4,,,,,
"RIVER GODAVARI- POCHERA WATER FALLS, POCHERA (V), BOATH (M), ADILABAD (D)",2.4,,,,,
"RIVER GANGA AT KANPUR U/S (SHUKLAGANJ U/S), U.P",2.4,,,,,
"RIVER GANGA AT KANNAUJ U/S (RAJGHAT), U.P",2.4,,,,,
"RIVER GANGA AT GANGA BRIDGE .NH19, DHEEMI",2.4,,,,,
"RIVER GALUDIH BARRAGE, GALUDIH, E.S",2.4,,,,,
RIVER DZUDZA RU IN KOHIMA,2.4,,,,,
RIVER DIKHOW AT DIKHOWMUKH CONFLUENCE WITH BRAHAMPUTRA,2.4,,,,,
"RIVER DEVAK 2 KM D/S FROM SHIV MANDIR AT UDHAMPUR,",2.4,,,,,
"RIVER DAMODAR NEAR ROHINI PROJECT, NK AREA, PO- DAKRA, RANCHI",2.4,,,,,
"RIVER CAUVERY ATGANJAM WATER SUPPLY INTAKE POINT NEAR GOSAI GHAT, SRIRANGAPATNA,MAYDYA",2.4,,,,,
RIVER BOLDAMGRE,2.4,,,,,
"RIVER BHADRA D/S MYSORE PAPER MILL (MPM), BHADRAWATI, SHIVAMOGGA",2.4,,,,,
RIVER BHADRA AT D/S OF BHADRAVATHI,2.4,,,,,
"RIVER BEGA MG ROAD, MANGALDOI",2.4,,,,,
RIVER BEAS D/S NEW BAJAURA BRIDGE,2.4,,,,,
"RIVER BARAK AT N.H. 53, TAMENGLONG .",2.4,,,,,
"RIVER ARKAVATHI AT HESARAGHATTA RESERVOIR,",2.4,,,,,
RIVER ARKAVATHI AT HESARAGHATTA RESERVOIR,2.4,,,,,
RAVI AT D/S AT CHAMERA III HEP,2.4,,,,,
"NARMADA AT LALPUR, NR WATER SUPPLY INTAKE POINT, JABALPUR",2.4,,,,,
"MAHANADI AT NARSINGHPUR, ORISSA",2.4,,,,,
KUAKHAI U/S BHUBANESWAR,2.4,,,,,
"KSHIPRA AT TRIVENISANGAM (1 KM. D/S OF SANGAM), M.P.",2.4,,,,,
"KRISHNA AT WADAPALLY AFTER CONFL. WITH R. MUSI, A.P.(SHIFTED FROM 1220)",2.4,,,,,
KRISHNA AT AMARAVATI,2.4,,,,,
KAMLA RIVER AT BENIPATTI (MADHUBANI),2.4,,,,,
GODAVARI AT POLAVARAM,2.4,,,,,
"GANGA AT ALLAHABAD D/S (SANGAM),",2.4,,,,,
DHANSIRI AT NUTON BASTI,2.4,,,,,
"DARNA RIVER AT ASWALI (DARNA DAM), LGATPURI, NASHIK",2.4,,,,,
CONFLUENCE OF BOKARO and DAMODAR RIVER NEAR ZARANGDI,2.4,,,,,
"CHAMBAL ENTERING IN RAJASTHAN AT GANDHI SAGAR DAM, KOTA",2.4,,,,,
"CAUVERY AT COLEROON, TAMILNADU",2.4,,,,,
BRAHMANI AT TALCHER FD/s,2.4,,,,,
ASHWANI RIVER AT SADHUPUL (U/S OF BRIDGE TOWARDS CHAIL. ),2.4,,,,,
YAMUNA AT YAMUNOTRI,2.391666667,,,,,
RIVER BAITARNI AT CHANDBALI D/S,2.39,,,,,
PANCHAGANGA RIVER AT SHIROL NEAR SHIROL INTAKE WELL.,2.3875,,,,,
DHOUS AT MADHUBANI,2.3875,,,,,
"BEAS AT MIRTHAL BRIDGE, GURDASPUR",2.3875,,,,,
BEAS AT 100M D/S INDUST. DISCH. GOINDWAL,2.3875,,,,,
RIVER TUNGABHADRA AT DADESUGUR BRIDGE GAUGING STATION,2.383333333,,,,,
"RIVER SUTLEJ AT U/S HUSSANIWALA - H/W FEROZEPUR, PUNJAB",2.383333333,,,,,
"RIVER SANKH AT TIGRA RESERVOIR, M.P.",2.383333333,,,,,
RIVER GOBARI AT KENDRAPARA U/S,2.383333333,,,,,
RIVER CAUVERY AT MUSIRI,2.383333333,,,,,
DEVI AT MACCHGAON,2.383333333,,,,,
BAITARNI RIVER AT TRIBINDHA,2.383333333,,,,,
RIVER SUTLEJ AT PHILLAUR U/S,2.38,,,,,
RIVER SUTLEJ AT PHAGWARA U/S (CHAHERU BRIDGE),2.38,,,,,
"RIVER UPPUTERU BEFORE CONFLUENCE WITH SEA, AT CHINNA GOLLAPALEM (V), KRUTHIVENNU (M)",2.375,,,,,
RIVER SUTLEJ U/S OF EXIT POINT OF DEHAR POWER HOUSE,2.375,,,,,
RIVER SUBANSIRI AT GERUKAMUKH (BEFORE CONFLUENCE WITH RIVER BRAHMAPUTRA),2.375,,,,,
"RIVER MAHANADI AT ARRANG, NEAR GANDHI BRIDGE",2.375,,,,,
RIVER GODAVARI AFTER CONFLUENCE WITH SABARI TRIBUTARY (KUNAVARAM) AT WADDIGUDEM(V) V.R. PURAM (M),2.375,,,,,
RIVER BHIMA AT D/S OF ROAD BRIDGE AT GANGAPUR VILLAGE,2.375,,,,,
NUNA NADI AT BIJIPUR,2.375,,,,,
"MAHANADI AT RUDRI U/S AT DHAMTORI RESERVOIR,CHHATISSGARH",2.375,,,,,
HINDON AT SAHARANPUR D/S,2.375,,,,,
"CAUVERY AT PUGALUR, KARUR",2.375,,,,,
"BHIMA AFTER CONF. WITH DAUND, DAUND, PUNE",2.375,,,,,
RIVER SUBARNAREKHA AT JAMSHEDPUR,2.366666667,,,,,
RIVER MANGALA AT PURI D/S GOLASAHI,2.366666667,,,,,
RIVER COOUM AT POONAMALLE,2.366666667,,,,,
"RIVER CHURNI, MAJHADIA, NADIA",2.366666667,,,,,
"PAWANA RIVER AT SANGAVIGAON, PUNE.",2.366666667,,,,,
DHELLA RIVER U/S AT KASHIPUR MORADABAD ROAD BRIDGE,2.366666667,,,,,
WARDHA D/S OF ACC GHUGGUS,2.35,,,,,
US OF VINDYADHARI RIVER AT HAROA BRIDGE,2.35,,,,,
"U/S HARBORA RIVER, WEST CHAMPARAN",2.35,,,,,
"TIHU RIVER (NEAR BRIDGE ALONG NH31) TIHU, NALBARI",2.35,,,,,
"RIVER WARDHA AT CONFLUENCE POINT OF PENGANGA and WARDHA AT JUGAD, WANI, YAVATMAL",2.35,,,,,
"RIVER TUIPUI, U/S NR CONFLUENCE PT KEILUNGLIAH STREAM, VENGTHAR, CHAMPHAI",2.35,,,,,
RIVER TLAWNG DOWNSTREAM AIZAWL,2.35,,,,,
RIVER TEESTA AFTER CONFLUENCS WITH RONGPOCHU AFTER MEETING THE INDUSTRIAL EFFLUENTS FROM THE TOWN RANGPO,2.35,,,,,
"RIVER SUTLEJ AT D/S NFL, PUNJAB",2.35,,,,,
"RIVER SUBARNREKHA AT RUCCA DAM, RUCCA, RANCHI",2.35,,,,,
"RIVER SUBARNAREKHA NEAR OBERIA ROAD BRIDGE, HATIA RANCH",2.35,,,,,
RIVER SUBARNAREKHA NEAR INTAKE WELL HATIA RAILWAY,2.35,,,,,
RIVER SUBARNAREKHA AT RAJGHAT (THENGUDIA),2.35,,,,,
RIVER SUBARNAREKHA AT CHANDIL BRIDGE,2.35,,,,,
RIVER MORNA D/S OF RAILWAY BRIDGE AKOLA,2.35,,,,,
"RIVER KHARSANG B/C WITH BURIDIHING NEAR KHARSANG (ASSAM- ARUNANCHAL BORDER), ASSAM",2.35,,,,,
RIVER KAKODONGA AT NH-37 CROSSING,2.35,,,,,
"RIVER GANGA PURANA RAJAPUR, RAJAPUR, KANPUR",2.35,,,,,
RIVER GANGA D/S RISHIKESH UTTARAKHAND,2.35,,,,,
"RIVER GANGA AT PATNA D/S (GANGA BRIDGE), GAIGHAT, PATNA",2.35,,,,,
"RIVER GANGA AT MUNGER D/S, CREAMINATION GHAT",2.35,,,,,
"RIVER CAUVERY D/S OF AT BETHRI BRIDGE , MURNAD",2.35,,,,,
RIVER CAUVERY AT BALMAVATI BRIDGE TO THANDRA HOLE TRIBUTARY,2.35,,,,,
"RIVER BHAVANI AT ELACHIVAZHY, KERALA",2.35,,,,,
"RIVER BARAK AT N.H. 53, TAMENGLONG",2.35,,,,,
RIVER BALASON AT KHAPRAIL MORE,2.35,,,,,
RIVER BAITARNI AT DHAMRA,2.35,,,,,
"RIVER AT BORDOWALI, HAORA",2.35,,,,,
RIVER ARKAVATHI AT D/S OF KANAKAPURA TOWN,2.35,,,,,
"RIVER AIE NEAR RAKHALDUBI DIST., BONGAIGAON, ASSAM",2.35,,,,,
RAMREKHA U/S HARINAGAR,2.35,,,,,
"NIRA AT SANGAVI,PHALTAN,SATARA",2.35,,,,,
"MUTHA RIVER AT DECCAN BRIDGE, PUNE.",2.35,,,,,
MULA-MUTHA AT MUNDHAWA BDG,2.35,,,,,
"MANJRA RIVER AT D/S OF LATUR, NEAR LATUR- NANDED BRIDGE AT BHATKHEDA, LATUR.",2.35,,,,,
"MALPRABHA AT D/S OF AIHOLE TOWN,",2.35,,,,,
MAHI AI UMETA BRIDGE,2.35,,,,,
"KALI SINDH AT ANICUT OF M/S CFCL GADEPAN, KOTA",2.35,,,,,
KABATABANDHA (BEF IMPACT OF INDL ACTIVITY IN KALINGANAGAR),2.35,,,,,
"GODAVARI RIVER AT U/S OF AURANGABAD RESERVOIR, KAIGAON TOKKA NEAR KAIGAON BRIDGE.",2.35,,,,,
"GODAVARI AT MANCHERIAL, NR RLY BDG B/C OF RALLAVAGU",2.35,,,,,
"GHAGHARA NEAR CHAPRA, RIBILGANJ, SARAN",2.35,,,,,
"DZUNA RU IN KOHIMA, ADJOINING THE NEW KOHIMA MUNICIPAL COUNCIL SOLID WASTE MANAGEMENT SITE, NAGALAND",2.35,,,,,
CAUVERY AT SATHYAGALAM BRIDGE,2.35,,,,,
"BICHIA, BDG GOVINDGARH ROAD",2.35,,,,,
"BAITARNI AT CHANDBALI,",2.35,,,,,
"RIVER GAWKADAL, SRG (SHERGHARI, SRG)",2.333333333,,,,,
"RIVER GANGA AT KACHHLA GHAT, ALIGARH",2.333333333,,,,,
DHANSIRI AT TOWN BOUNDARY BRIDGE (DIPHU ROAD),2.333333333,,,,,
"BHIMA AT FEROZABAD VILLAGE (D/S),",2.333333333,,,,,
"CAUVERY AT KUMBAKONAM, THANJAVUR, TAMILNADU",2.33,,,,,
SINDH AT DABRA,2.325,,,,,
RIVER TUNGABHADRA AT HARALAHALLI BRIDGE,2.325,,,,,
"RIVER NEAR NEWTA DAM,JAIPUR,RAJSTHAN",2.325,,,,,
"RIVER MAHANADI AT SIHAWA, ORIGIN POINT OF RIVER MAHANADI",2.325,,,,,
RIVER LOHIT AT ALUBARI (D/S),2.325,,,,,
RIVER KELO D/S LAHANGAPALI BRIDGE MIDMIDA VILLAGE,2.325,,,,,
RIVER GANGA AT D/S BUXAR NEAR VEER KUNWAR SINGH ROAD BRIDGE,2.325,,,,,
"RIVER BHAVANI AT D/S OF BHAVANISAGAR, SATHYAMANGALAM, ERODE, TAMILNADU",2.325,,,,,
MAHANADI AT KHARAD CHHATISSGARH.,2.325,,,,,
CHAMBAL AT DHOLPUR,2.325,,,,,
"BHIMA AT PUNE U/S VITHALWADI, HAWELI, PUNE",2.325,,,,,
BAITARNI AT CHANDBALI,2.325,,,,,
"RIVER MULA AT HARRISON BRIDGE NEAR MULA- PAWANA SANGAM, VILLAGE- BOPODI,TALUKA- HAWELI, DISTRICT- PUNE.",2.3225,,,,,
"RIVER KALIASOT NEAR ROAD BRIDGE, MANDIDEEP",2.32,,,,,
BRAHMANI AT RENGALI,2.32,,,,,
"WENA RIVER AT U/S OF MOHATA MILLS, NEAR RAILWAY BRIDGE, HINGANGHAT",2.316666667,,,,,
RIVER WAHKHLEK KHLEK AT SAITSOHPEN,2.316666667,,,,,
RIVER DAMODAR AT SINDRI,2.316666667,,,,,
RIVER ADYAR AT MARAIMALAI BRIDGE,2.316666667,,,,,
KATHAJODI AT CUTTACK U/s,2.316666667,,,,,
GANGA AT HARIDWAR D/S,2.316666667,,,,,
DAYA AT KANAS,2.316666667,,,,,
"DARNA RIVER AT CHEHEDI PUMPING STATION, NASHIK.",2.316666667,,,,,
RIVER GOMTI AT SULTANPUR U/S,2.3125,,,,,
DZUCHA RU IN KOHIMA,2.3125,,,,,
"BHIMA RIVER AT KOREGAON NEAR KOREGAON BRIDGE, SHIRUR, PUNE",2.31,,,,,
"YAMUNA AT SONAULI ROAD, SHAMLI BORDER , PANIPAT (HARYANA)",2.3,,,,,
YAMUNA AT MAZAWALI,2.3,,,,,
"WATER INTAKE POINT FOR BANKURA TOWN ON RIVER DWARAKESHWAR, BANKURA",2.3,,,,,
TUNIA RIVER AT D/S BRPL,2.3,,,,,
TUNGABHADRA AT D/S OF GANGAWATHI,2.3,,,,,
TAPI AT NEPA NAGAR 100 METRE D/S AFTER MIXING PANDHAR NALLA,2.3,,,,,
"SHUKRA TAL, MUZAFFARNAGAR, NEAR GANGA RIVER",2.3,,,,,
"ROAD BRIDGE-DEHRI-ON- SONE, ROHTAS",2.3,,,,,
"RIVER WENA AT U/S OF MOHATA MILLS, NEAR RAILWAY BRIDGE, HINGANGHAT, WARDHA",2.3,,,,,
"RIVER WAINGANGA AT D/S OF ELLORA PAPER MILLS, VILLAGE. TUMSAR, TALUKA. TUMSAR, BHANDARA.",2.3,,,,,
"RIVER TUIRIAL MID STREAM, AIRFIELD, D/S OF TUIRIAL WASTE MANAGEMENT CENTRE,AIZAWL DIST",2.3,,,,,
"RIVER TLAWNG U/S, PIALTHLENG ZOTLANG, LUNGLEI",2.3,,,,,
"RIVER TLAWNG AT PHE WATER RESERVOIR, TUIKHUAHTLANG, AIZAWL",2.3,,,,,
"RIVER TINGRAI NEAR TINSUKIA MSW DUMPING SITE, ITAKHOLA",2.3,,,,,
"RIVER TEIREI RIVER, NEAR BAWNGVA VIILAGE, MAMIT",2.3,,,,,
"RIVER TEIREI D/S NR CONFLUENCE PT WITH TLAWNG RIVER, SAPMARA, BAIRABI,KOLASIB DIST.",2.3,,,,,
RIVER TAWI BELOW TAWI BRIDGE,2.3,,,,,
RIVER SUTLEJ AT BUNGA SAHIB,2.3,,,,,
RIVER SUFFRY AT MAIBELLA,2.3,,,,,
"RIVER SUBARNAREKHA U/S HCL GHATSHILA, E.S",2.3,,,,,
"RIVER SIKRAHNA LAURIA- NARKATIAGANJ ROAD BRIDGE, WEST CHAMPARAN",2.3,,,,,
RIVER SANO RU IN KOHIMA,2.3,,,,,
RIVER RANGPO AT D/S OF RORATHANG BRIDGE,2.3,,,,,
RIVER RANGIT AT RESHI,2.3,,,,,
"RIVER PENGANGA D/S OF ISAPUR DAM, VILLAGE- ISAPUR,TALUKA- PUSAD, DISTRICT- YAVATMAL.",2.3,,,,,
RIVER PABBAR AT HATKOTI RESERVOIR,2.3,,,,,
"RIVER NEAR NEWTA DAM, JAIPUR, RAJASTHAN",2.3,,,,,
"RIVER MULA-MUTHA AT MUNDHAWA BRIDGE, MUNTHAWA,HAWELI, PUNE",2.3,,,,,
RIVER KUPLI AT LOOSKI,2.3,,,,,
RIVER KRISHNA AT GADWAL BRIDGE,2.3,,,,,
"RIVER KRISHNA AT ALMATTI DAM HAVELI , OLD JACKWELL POINT, BAGALKOTE",2.3,,,,,
"RIVER KRISHNA AFTER CONFLUENCE WITH RIVER MUSI AT VADAPALLI (V), DACHEPALLI (M) BETWEEN ANDHRA PRADESH and TELANGANA",2.3,,,,,
"RIVER KOINA RIVER, MANOHARPUR, W.S",2.3,,,,,
"RIVER KINNERASANI A/C OF KTPS ASH POND EFFLUENTS, KHAMMAM",2.3,,,,,
"RIVER KHAWTHLANGTUIPUI ,TLABUNG, LUNGLEI",2.3,,,,,
RIVER KHARKHAI BEFORE MEETING SWARNREKHA RIVER,2.3,,,,,
RIVER KHARASROTA AT BINJHARPUR,2.3,,,,,
"RIVER INDRAVATI NELSONNAR,A/C OF DANTEWADA",2.3,,,,,
"RIVER HASDEO AT DRINKING WATER INTANK WELL OF MUNICIPAL CO. KORBA (BEFORE TREATMENT ) AT LOHADIA VILLAGE,",2.3,,,,,
RIVER GOMTI AT JAUNPUR D/S,2.3,,,,,
"RIVER GODAVARI AT RAJAMUNDRY D/S OF NALLA CHANNEL, RAJAMUNDRY",2.3,,,,,
"RIVER GANGA AT KACHCHI-DARGAH- BIDUPUR NEAR ROAD BRIDGE, PATNA",2.3,,,,,
"RIVER GABHARU NEAR BRIDGE AT NH- 52, NEAR TUMIUKI, SONITPUR",2.3,,,,,
"RIVER CHANDRABHAGA AT U/S OF PANDHARPUR TOWN, VILLAGE. GURSALE, TALUKA. PANDHARPUR, SOLAPUR.",2.3,,,,,
"RIVER CAUVERY AT THANJAVUR, TAMILNADU",2.3,,,,,
"RIVER BHIMA DOWNSTREAM, DHULKED VILL",2.3,,,,,
"RIVER BEAS AT TALWARA H/W, PUNJAB",2.3,,,,,
"RIVER BARAKAR AT ASANSOL (WATER INTAKE POINT), BURDWAN,WEST BENGAL",2.3,,,,,
RIVER BARAK AT D/S OF SILCHAR,2.3,,,,,
"RIVER ARKAVATHI AT MANCHANBELE RESERVOIR, MANCHANABALE DAM",2.3,,,,,
RAW WATER FOR LWSS OF NAUTI KHAD AT GUMMA (BASANTPUR),2.3,,,,,
RAM REKHA RIVER AT HARINAGAR,2.3,,,,,
"PENNAR AFTER CONF. WITH CHEYYURU,SOMASILE,A.P.",2.3,,,,,
"PAWANA AT DAPODI BRIDGE AT PAWANAMULLA SANGAM, DAPODI, HAWELI, PUNE",2.3,,,,,
PABBAR D/S SWARAKUDDU,2.3,,,,,
NEAR CHECK GATE (DIMAPUR KHUTKHUTI ROAD),2.3,,,,,
"MYNTANG RIVER AT NARTIANG, JAYANTIA HILLS",2.3,,,,,
"MANUSMAR AT PARSHURAMPUR, RIGA - BELSUND ROAD,",2.3,,,,,
MANJHI KHAD D/S DHARAMSHALA AT CHETRU,2.3,,,,,
"MAHANADI AT RUDRI U/S AT DHAMTORI RESERVOIR, CHHAT",2.3,,,,,
KRISHNA AT WADAPALLY AFTER CONFL. WITH R. MUSI,2.3,,,,,
GODAVARI AT PANCHAVATI RAMKUND,2.3,,,,,
GODAVARI AT MANCHERIAL,2.3,,,,,
"DARNA RIVER AT MES SITE PUMPING STATION, BHAGUR, NASHIK.",2.3,,,,,
"BURHI GANDAK AT LAL BAGLA GHAT, MOTIHARI DHAKA ROAD, EAST CHAMPARAN",2.3,,,,,
"BURHI GANDAK AT AKHARAGHAT, MUZAFFARPUR",2.3,,,,,
"BRAHMANI AT RENGALI, ORISSA",2.3,,,,,
"BHADRA AT D/S OF KIOCL ROAD BRIDGE, NEAR HOLEHUNNUR,KARNATAKA",2.3,,,,,
NARMADA AT SETHANIGHAT,2.29,,,,,
"YAMUNA AT KESIGHAT, VRINDAVAN",2.2875,,,,,
"GANGA AT KADAGHAT, ALLAHABAD",2.2875,,,,,
"RIVER SONE AT WATER INTAKE POINT BHARTIYA RAIL BIJALI CO. LTD (BRBCL) NAVINAGAR, AURANGABAD",2.283333333,,,,,
"RIVER JHELUM AT SOPORE, CONFLUENCE POINT OF WULAR LAKE",2.283333333,,,,,
MANGALA AT PURI U/s MALATIPATPUR,2.283333333,,,,,
KABATABANDHA (BEFORE IMPACT OF INDUSTRIAL ACTIVITY IN KALINGANAGAR AREA),2.283333333,,,,,
"DENWA NEAR SARNI, ROAD BRIDGE",2.283333333,,,,,
RIVER GOMTI AT MOHMEAK D/S,2.28,,,,,
"SONE AT JARWAHI NEAR ROAD BRIDGE, SHAHDOL",2.275,,,,,
RIVER SUTLEJ U/S CONFLUENCES OF RIVER TIDONG,2.275,,,,,
RIVER NARMADA AT DOWN-STREAM OF TEXTILE UNIT VILLAGE. HOLIPURA BUDNI DISTRICT SEHORE (M.P.),2.275,,,,,
RIVER NAMCHIK AT KHARSANG,2.275,,,,,
"RIVER KOSI AT KASHIPUR BAJPUR ROAD BRIDGE,KASHIPUR,US NAGAR",2.275,,,,,
RIVER IRIL AT LILONG,2.275,,,,,
"RIVER GANGA AT UMA NATH MANDIR,BARH",2.275,,,,,
RIVER GANGA AT MANJHIGHAT DIST. CHHAPRA(BIHAR),2.275,,,,,
"RIVER GANGA AT DIGHA, NEAR J P SETU, PATNA U/S",2.275,,,,,
RIVER DIKRONG AT NIRJULI (U/S),2.275,,,,,
"RIVER BRAHMAPUTRA AT DIBRUGARH, ASSAM",2.275,,,,,
RIVER BAIRA SIUL D/S SURGANI,2.275,,,,,
MULA-MUTHA RIVER AT MUNDHAWA BRIDGE.,2.275,,,,,
