Year,AVERAGE of BOD_Avg,AVERAGE of DO_Avg,,,,
"RIVER MAHI AT GAMMON BRIDGE, BANSWARA(RAJASTHAN)",1.7,,,,,
RIVER MAHANADI AT SHEORINARAYAN VILLAGE D/S NEAR ROAD BRIDGE,1.7,,,,,
"RIVER MAHANADI AT ARRANG, RAIPUR, CHHATISGARH.",1.7,,,,,
RIVER KYNSHI AT NANGKHNUM,1.7,,,,,
"RIVER KRISHNA AT MATTEPALLY, 500 MTS. BEFORE BATHING GHAT, SURYAPET",1.7,,,,,
RIVER KHARASROTA AT KHANDITARA (D/S OF INDUSTRIAL ACTIVITIES AT KALINGA NAGAR),1.7,,,,,
"RIVER HIRAN AFTER MIXING PARIYAT RIVER NEAR ROAD BRIDGE AT VILL GANIYARI,",1.7,,,,,
"RIVER GODAVARI AT RAMKUND, VILLAGE- PANCHAVATI, TALUKA- NASHIK, DISTRICT- NASHIK.",1.7,,,,,
"RIVER GODAVARI AT GODAVARIKHANI NEAR BATHING GHAT , PEDDAPALLI",1.7,,,,,
RIVER GOBARI AT KENDRAPARA D/S,1.7,,,,,
"RIVER GANGA TIGRI GANGA GHAT, VILLAGE-TIGARI, AMROHA",1.7,,,,,
"RIVER GANGA AT WATER INTAKE POINT, BHAGALPUR",1.7,,,,,
"RIVER GANGA AT PRAYAGRAJ D/S (SANGAM), U.P.",1.7,,,,,
RIVER GANGA AT FARRUKABAD,1.7,,,,,
"RIVER DHANSIRI NEAR BRIDGE AT NH-15, DHANSIRI BHALUKMARI JUNGLE, UDALGURI",1.7,,,,,
RIVER CHAMBAL AT 100M D/S OF GANDHI SAGAR DAM. MANDSAUR,1.7,,,,,
"RIVER CAUVERY AT KARUTHATTANUDI THANJAVUR,",1.7,,,,,
"RIVER BHIMA AT PUNE (MUTHA RIVER) AT U/S OF VITHALWADI NEAR SHANKAR MANDIR, VILLAGE. VITHALWADI, TALUKA. HAWELI, DISTRICT. PUNE.",1.7,,,,,
"RIVER BHAGIRATHI B/C TO RIVER ALAKNANDA AT DEVPRAYAG,DIST-TEHRI GARHWAL",1.7,,,,,
"PEDHI NEAR ROAD BRIDGE AT DADHIPEDHI VILLAGE, BHATKULI, AMRAVATI",1.7,,,,,
PARVATI B/C TO BEAS,1.7,,,,,
"PANAM AT LUNAWADA,",1.7,,,,,
"MUNERU B/c WITH KRISHNA, NANDIGAMA",1.7,,,,,
MULA AT HARRISON BRIDGE NEAR MULA PAWANA SANGAM,1.7,,,,,
"MAHANADI, POWER CHANNEL D/S NEAR BURLA",1.7,,,,,
MAHANADI U/S CUTTACK,1.7,,,,,
KRISHNA D/S ISLAMPUR,1.7,,,,,
"KRISHNA AT VEDADRI , GUNTUR",1.7,,,,,
KOSI AT KASHIPUR BAJPUR ROAD BRIDGE,1.7,,,,,
KANIHA D/S,1.7,,,,,
"INDRAVATI RIVER A/C DANTEWADA RIVER, NELSONNAR, DANTEWADA, CHATTISGARH",1.7,,,,,
"HIRAN, NH -12 ROAD BRIDGE VIL VIKRAMPUR ,DIST. NARSINGPUR",1.7,,,,,
GOMTI D/S JAUNPUR,1.7,,,,,
"GANGA RIVER AT WATER INTAKE POINT, BHAGALPUR",1.7,,,,,
"GANGA AT BITHOOR (KANPUR), U.P.",1.7,,,,,
DEVAK RIVERUDHAMPUR(NEAR SHIV MANDIRD/S)L.H.S.,1.7,,,,,
DAMSITE AT THEIN,1.7,,,,,
CHENAB AT JAL PATAN MANDIR AFTER MEETING WITH MAIN DRAIN OF AKHNOOR CITY(1.5 KMD/S FROM SPOT),1.7,,,,,
CAUVERY D/S OF MADDUR WATER SUPPLY TREATMENT PLANT AT BACHALLI,1.7,,,,,
"BURHI GANDAK AT Z ROAD BRIDGE, SAMASTIPUR",1.7,,,,,
BRAHMANI D/S PANPOSH,1.7,,,,,
BRAHAMPUTRA RIVER AT BISWANATH GHAT,1.7,,,,,
BHEDEN B/C WITH IB,1.7,,,,,
"BHAGIRATHI AT GANGOTRI,",1.7,,,,,
BHADRA AT U/S OF KIOCL,1.7,,,,,
"BHADRA AT D/S OF KIOCL ROAD BRIDGE, NEAR HOLEHUNNUR",1.7,,,,,
"ASHWANI KHAD D/S OF VILLAGE SADHUPIL, TEHSIL KANDAGHAT, DISTRICT SOLAN.",1.7,,,,,
"RIVER RAVI AT LAKHANPUR, 1 KM D/S FROM MADHOPUR BRIDGE",1.69,,,,,
BHARGAVI AT CHANDANPUR,1.6875,,,,,
RUSSELKUNDA RESERVOIR,1.683333333,,,,,
RIVER YAMUNA AT HANUMANCHATTI,1.683333333,,,,,
RIVER SUTLEJ AT U/S RAMPUR,1.683333333,,,,,
RIVER KUSUMI NADI NEAR TANGI (LAXMIDHARA PUR),1.683333333,,,,,
RIVER KUAKHAI AT BHUBANESWAR FU/S,1.683333333,,,,,
"RIVER KSHIPRA AT RAMGHAT AT UJJAIN, M.P.",1.683333333,,,,,
RIVER KHARASROTA AT AUL,1.683333333,,,,,
RIVER KAMALA AT BENIPATTI (MADHUBANI),1.683333333,,,,,
"RIVER JALANGI, D/S OF KRISHNA NAGAR, NADIA",1.683333333,,,,,
"RIVER GANGA NEAR DANAPUR (NEAR PIPA PUL) ,PATNA",1.683333333,,,,,
"RIVER GANGA AT DALMAU (RAI BAREILLY), U.P.",1.683333333,,,,,
RIVER COOUM AT ARUMBAKKAM,1.683333333,,,,,
"RIVER BURHIDIHING AT MARGHERITA, ASSAM",1.683333333,,,,,
"RIVER BANAS AT TRIVENI SANGAM, BHILWARA",1.683333333,,,,,
"MALPRABHA AT WATER ABSTR. PT. TO HUBLI, DHARWAR,",1.683333333,,,,,
SWAN RIVER B/C OF GARNI KHAD,1.675,,,,,
"SEONATH AT U/S RAJNANDGAON, CHHATISGARH.",1.675,,,,,
"SABARMATI AT MAHUDI JAIN TEMPLE, 150 KM. FORM ORIGIN,",1.675,,,,,
"RIVER TUIKUAL STREAM, U/S, MIZORAM NEW CAPITAL COMPLEX , DINTHAR, AIZAWL",1.675,,,,,
RIVER TEESTA AT JALPESH,1.675,,,,,
"RIVER SONE AT ROAD BRIDGE CHOPAN,DIST- SONEBHADRA (U.P.)",1.675,,,,,
"RIVER KRISHNA AFTER CONFLUENCE OF RIVER MUSI AT WADAPALLY (V), DAMARACHARLA (M), NALGONDA(D)",1.675,,,,,
RIVER KATHAJODI AT CUTTACK FD/S AT MATTAGAJPUR,1.675,,,,,
RIVER KATHAJODI AT CUTTACK FD/S AT KAMASASAN,1.675,,,,,
"RIVER GOMTI AT SITAPUR U/S DADNAMAU GHAT, U.P.",1.675,,,,,
"RIVER GODAVARI-RIVER GODAVARI AT MANCHERIAL, NEAR RAIL WAY BRIDGE B/C OF RALLAVAGU, MANCHERIAL (D)",1.675,,,,,
"RIVER BHELLA U/S OF KASHIPUR,US NAGAR",1.675,,,,,
RIVER BALD D/S LANDFILLSITE AT BADDI,1.675,,,,,
RIVER ALAKNANDA A/C OF RIVER MANDAKINI AND RIVER ALAKNANDA AT RUDRAPRAYAG,1.675,,,,,
"RAMREKHA RIVER AT HARINAGAR, WEST CHAMPARAN",1.675,,,,,
"MAHANADI AT ARRANG, RAIPUR",1.675,,,,,
"BEAS AT 1KM.D/S OF EFFL. DISH. POINT AT MUKERIAN ,",1.675,,,,,
"RIVER YAMUNA AT D/S OF AGRA, U.P.",1.666666667,,,,,
RIVER SUBARNAREKHA AT GATALSUD DAM,1.666666667,,,,,
"RIVER SABARMATI AFTER CONF. WITH MESHWA AT VAUTHA (NEAR DHOKLA),",1.666666667,,,,,
RIVER DHANSIRI AT TOWN BOUNDARY BRIDGE (DIPHU ROAD),1.666666667,,,,,
RIVER BRAHMANI AT ROURKELA FD/S AT BIRITOLA,1.666666667,,,,,
RIVER BARAK AT SENAPATI,1.666666667,,,,,
"RIVER BAGMATI AT MUZAFFARPUR- SITAMARHI ROAD BRIDGE, SITAMARHI",1.666666667,,,,,
GANGA AT DAKSHINESHWAR,1.666666667,,,,,
RIVER BEAS U/S SUJANPUR TIHRA,1.66,,,,,
MANJHI KHAD U/S DHARAMSHALA OF KHANIYARA,1.66,,,,,
DHAULI KHAD AT CHARAN GANGA MEDI,1.66,,,,,
"U/S OF KALINGARAYAN CANAL (B5), ERODE",1.65,,,,,
TAPI AT SURAT U/S KATHORE,1.65,,,,,
SEONATH U/S RAJNANDGAON,1.65,,,,,
"SABARMATI AT RAILWAY BRIDGE AHMEDABAD,",1.65,,,,,
"SABARMATI AFTER CONF. WITH MESHWA AT VAUTHA (NEAR DHOKLA),",1.65,,,,,
"RIVER YAMUNA AT MATHURA D/S , NEAR SHAMSHAN GHAT U.P.",1.65,,,,,
RIVER UMNGOT AT DAWKI,1.65,,,,,
"RIVER TAPI AT BHUSAWAL U/S, BHUSAWAL RAILWAY COLONY, BHUSAWAL, JALGAON",1.65,,,,,
"RIVER SWARNREKHA , NEAR RING ROAD BRIDGE SEMBO, NAGRI, RANCHI",1.65,,,,,
RIVER SUTLEJ AT NANGAL (H.P.),1.65,,,,,
"RIVER SUSWA AT MATHURAWALA, DEHRADUN",1.65,,,,,
"RIVER SARSA AT BADDI , ,GHANOLI VILLAGE) PUNJAB",1.65,,,,,
"RIVER RANGIT AT UPSTREAM OF DAM , RANGIT STAGE- IV RESHI NHPC RESHI SORENG,DIST",1.65,,,,,
"RIVER RANGA NADI D/S OF HYDEL PROJECT, ASSAM",1.65,,,,,
RIVER PARVATI BEFORE MEETING RIVER CHAMBAL AT KHAT,1.65,,,,,
"RIVER PAPANASINI AT THIRUNELLY, WAYANAD",1.65,,,,,
RIVER NARMADA AT MANDLA NEAR ROAD BRIDGE. M.P.,1.65,,,,,
"RIVER KRISHNA AT JOGULAMBA TEMPLE, ALAMPUR(VandM), JOGULAMBA GADWAL(D)",1.65,,,,,
"RIVER KRISHNA - CONFLUENCE OF RIVER KRISHNA and RIVER MUSI AT WADAPALLY (V), DAMARCHARLA (M), NALGONDA DISTRICT",1.65,,,,,
"RIVER KABINI AT WATER INTAKE OF KIADB AT NANJANGUD,",1.65,,,,,
"RIVER GANGA AT GARHMUKTESHWAR, U.P",1.65,,,,,
"RIVER D/S OF KANSI AT MIDNAPORE, NEAR NEW HANUMAN MANDIR, GANDHIGHAT, MEDINIPORE(W)",1.65,,,,,
RIVER CHAMBAL ENTERING IN RAJASTHAN AT GANDHI SAGA,1.65,,,,,
RIVER CAUVERY LOCATIONS AT KUMARAPALAYAM,1.65,,,,,
"RIVER CAUVERY AT TRICHY, GRAND ANAICUT,",1.65,,,,,
"RIVER CAUVERY AT PUGALUR, KARUR,",1.65,,,,,
RIVER BUDHABALANGA AT BALASORE U/S,1.65,,,,,
RIVER BRAHMANI AT KABATABANDHA (BEFORE IMPACT OF INDUSTRIAL ACTIVITY IN KALINGANAGAR),1.65,,,,,
"RIVER BHIMA AT TAKLI, SOLAPUR, (MAHARASHTRA)",1.65,,,,,
"RIVER BHIMA AT DAUND NEAR MAHADEV TEMPLE,VILLAGE- DAUND, TALUKA- DAUND, DISTRICT- PUNE.",1.65,,,,,
RIVER BHIMA AT CONFLUENCE OF JEWARGI TOWN SEWAGE DISPOSAL POINT,1.65,,,,,
"RIVER AMRAVATI AT VILLAGE DADHAL , TA ANKLESHWAR, BHARUCHNR RAILWAY BRIDGE, AT VILLAGE DHADHAL , TA: ANKLESHWAR, DIST BHARUCH",1.65,,,,,
"RIVER ALAKNANDA B/C TORIVER BHAGIRATHI AT DEVPRAYAG,DIST-TEHRI GARHWAL",1.65,,,,,
RAMIALA NEAR KAMAKHYANAGAR,1.65,,,,,
POONPUN RIVER NEAR KINZER ROAD BRIDGE,1.65,,,,,
"PAWANA AT DAPODI BRIDGE, AT PAWANA- MULLA SANGAM,PUNE.",1.65,,,,,
"MULA AT AUNDH BRIDGE, AUNDGAON",1.65,,,,,
MAHI AT BADNAWAR,1.65,,,,,
"MAHANADI AT SAMBALPUR D/S, ORISSA",1.65,,,,,
"MADHYA GANGA BARRAGE, BIJNORE",1.65,,,,,
KUNDRA NALLAH AT JODA,1.65,,,,,
KRISHNA RIVER AT KRISHNAVENNA SANGAM AT MAHULI.,1.65,,,,,
KATHAJODI AT CUTTACK D/s,1.65,,,,,
KABBANI AT WATER INTAKE OF KIADB AT NANJANGUD,1.65,,,,,
"GODAVARI U/S OF AURANGABAD RESERVOIR, KAIGAON TOKKA NEAR KAIGAON BRIDGE.",1.65,,,,,
GODAVARI AT KAMALPUR U/S M/S AP RAYONS LTD. INTAKE,1.65,,,,,
GARGA RIVER NEAR TELMUCHO BRIDGE,1.65,,,,,
GANGA D/S PATNA (GANGA BRIDGE),1.65,,,,,
"GANGA AT MAA AMBIKA ASTHAN, AAMI, SARAN",1.65,,,,,
GANGA AT BARAHIA,1.65,,,,,
"GANDAK AT SONEPUR, PATNA (B/C GANGA)",1.65,,,,,
GANDAK AT SAMASTIPUR ROAD BRIDGE,1.65,,,,,
"DIKHOW RIVER AT NAGINI MORA (INTERSTATE BOUNDARIES, ASSAM NAGALAND)",1.65,,,,,
CAUVERY AT RN PUDUR,1.65,,,,,
"CAUVERY AT MAYILADUTHURAI, NAGAPATTINAM,",1.65,,,,,
"CAUVERY AT KOMARAPALAYAM, NAMAKAL,",1.65,,,,,
"CAUVERY AT 1KM. D/S OF BHAVANI RIVER CONFL., TAMIL",1.65,,,,,
BRAHMANI U/S PANPOSH,1.65,,,,,
"BANGANGA (BATHING GHAT), KATRA",1.65,,,,,
BALASORE U/S,1.65,,,,,
KRISHNA ANKALI BRIDGE ALONG CHIKKODI KAGWAD ROAD,1.6375,,,,,
"GOMTI AT JAUNPUR D/S, U.P.",1.6375,,,,,
DAHA AT SIWAN,1.6375,,,,,
RIVER TAWI AT SHETALI LIFTING POINT NAGROTA(5KM U/S TAWI BRIDGE),1.633333333,,,,,
RIVER TAWI AT BELICHARANA(4KM D/S TAWI BRIDGE),1.633333333,,,,,
RIVER NANDIRA U/S AT KUKUDANGA,1.633333333,,,,,
RIVER KYNSHI AT RANIKOR,1.633333333,,,,,
"RIVER KUNDLI AT KUNDLI/ SAPAKHOWA, SADIA, ASSAM",1.633333333,,,,,
RIVER DAMODAR AT PANCHET DAM,1.633333333,,,,,
"RIVER CHAMBAL AT GWALIOR ROAD BRIDGE, UDI, ETAWAH DIST.",1.633333333,,,,,
RIVER BRAHMANI AT BONAIGARH,1.633333333,,,,,
"GHATPRABHA AT W.A. POINT TO GOKAK TOWN,",1.633333333,,,,,
CAUVERY AT BANNUR BRIDGE,1.633333333,,,,,
"RIVER TONS AT MADHAVGARH, NEAR PHED W/S INTAKE POINT, SATNA",1.625,,,,,
"RIVER RUSHIKULYA AT GANJAM U/S (NEAR BABA TOLEKESWAR TEMPLE, KARAPADA) MADHOPUR",1.625,,,,,
RIVER RASULPUR AT RASULPUR GHAT,1.625,,,,,
RIVER ONG AT DHARUAKHAMMA,1.625,,,,,
RIVER MAHI AT VILLAGE BAJNA (MP and RJASTHAN),1.625,,,,,
RIVER KICCHA AT PULL BHATTA,1.625,,,,,
"RIVER KALINADI AT U/S OF GULAOTHI TOWN IN BULANDSAHAR, U.P.",1.625,,,,,
RIVER HASDEO DOWN STREAM OF HASDEO RIVER NEAR VILLAGE URGA KORBA,1.625,,,,,
"RIVER GODAVARI AT TAPOVAN,VILLAGE- TAPOVAN, TALUKA- NASHIK, DISTRICT- NASHIK.",1.625,,,,,
"RIVER GODAVARI AT KALESHWARAM, 500 MTS. BEFORE BATHING GHAT, KALESHWARAM (V), MAHADEVPUR (M),JAYASHANKAR BHUPALAPALLY",1.625,,,,,
"RIVER GODAVARI AT BURGAMPAHAD , BHADRADRI KOTHAGUDEM",1.625,,,,,
"RIVER GANGA D/S AT BALKUMARI MANDIR, AJEETPUR, HARIDWAR",1.625,,,,,
"RIVER GANGA AT KADAGHAT, KAUSHAMABI",1.625,,,,,
"RIVER GANDAK AT REWAGHAT, MUZAFFARPUR",1.625,,,,,
RIVER BEAS D/S KULLU,1.625,,,,,
"RIVER BAHELA AT BADLI VILLAGE LOHIYA BRIDGE , TANDA (U.P.)",1.625,,,,,
"RIVER AJAB BOURALI AT PETLAWAD DAM PETLAVAD, JHABUA",1.625,,,,,
"PENNAR A/c WITH CHEYYURU, SOMASILA, NELLORE",1.625,,,,,
NANDIRA D/S AT DASNALI,1.625,,,,,
"MUTHA RIVER NEAR VEER SAVARKAR BHAVAN, PUNE",1.625,,,,,
GANGA AT ULUBERIA,1.625,,,,,
BEAS AT TALWARA (PONG DAM),1.625,,,,,
SAMBALPUR FD/S T SHANKARMATH,1.616666667,,,,,
RIVER SUBARNAREKHA AT GOPIBALLAVPUR (WEST BENGAL),1.616666667,,,,,
"RIVER KAROLA, D/S OF JALPAIGURI, NEAR MIN BHAWAN, JALPAIGURI",1.616666667,,,,,
RIVER GANGUA AT VADIMULA,1.616666667,,,,,
"RIVER GANGA AT DAKSHMINESHWAR, KOLKATA, WEST BENGAL",1.616666667,,,,,
"RIVER GANGA AT CHAMPANAGAR, BHAGALPUR",1.616666667,,,,,
RIVER DHANSIRI AT BOKAJAN,1.616666667,,,,,
RIVER BAITARNI AT UNCHABALI,1.616666667,,,,,
DAMODAR AT RAMGARH ROAD BRIDGE,1.616666667,,,,,
"BANGANGA (BATHING GHAT), KATRA,",1.616666667,,,,,
"BHAVANI AT BHAVANI SAGAR, TAMILNADU",1.6125,,,,,
WAGHUR B/C SAKEGAON WITH TAPI JALGAON,1.6,,,,,
"VINDYADHARI, U/S HAROA BRIDGE",1.6,,,,,
"VENNA AT VARYE, SATARA.",1.6,,,,,
"UPPER GANGA CANAL D/S AT ROORKEE, HARIDWAR",1.6,,,,,
U/S KHAIRIAN SOLID WASTE DUMPING SITE BILASPUR,1.6,,,,,
TUNGHA AT D/S OF SHIMOGA TOWN,1.6,,,,,
TUNGABHADRA AT HONNALI BRIDGE,1.6,,,,,
TAPI RIVER NEAR BARDOLI (KAPP BRIDGE) BARDOLI,1.6,,,,,
"TAPI AT SURAT U/S KATHORE,",1.6,,,,,
"SUTLEJ AT D/S KIRATPUR SAHIB, PUNJAB",1.6,,,,,
"SUBARNREKHA RIVER U/S HINDALCO IND LTD, MURLI WORKS, CHHOTAMURI, RANCHI",1.6,,,,,
"SATLUJ RIVER B/C WITH RIVER SPITI AT KHAB, DISTT.KINNAUR",1.6,,,,,
"SABARMATI AT VILL. MIROLI TALUKA DASCROI, AHMEDABAD,",1.6,,,,,
SABARMATI A/C WITH MESHWA AT VAUTHA NEAR DHOKLA,1.6,,,,,
"RUSHIKULYA AT GANJAM U/S (NEAR BABA TOLEKESWAR TEMPLE, KARAPADA)",1.6,,,,,
"RIVER YAMUNA AT VISHRAMGHAT, MATHURA",1.6,,,,,
RIVER YAMUNA AT HAMIRPUR,1.6,,,,,
"RIVER WAINGANGA RIVER NEAR VILL. BUDUNDA MALANJKHAND, DISTT BALAGHAT",1.6,,,,,
"RIVER TUIRIAL MID STREAM, TUIRIAL VILLAGE,D/S OF TUIRIAL BRIDGE",1.6,,,,,
"RIVER TLAWNG D/S,SUARPUI, BAIRABI HEPP DAM SITE, BAIRABI,KOLASIB DIST.",1.6,,,,,
RIVER SWARNREKHA NEAR INTAKE WELL HATIA RAILWAY,1.6,,,,,
"RIVER SUTLEJ AT U/S BUDHA NALLAH (UPPER), PUNJAB",1.6,,,,,
RIVER SUBARNAREKHA AT MURI ROAD BRIDGE,1.6,,,,,
RIVER SATLUJ AT PHILLAUR U/S,1.6,,,,,
RIVER SATLUJ AT LUDHIANA U/S,1.6,,,,,
"RIVER NGENGPUI STREAM, NR KALADAN MULTI MODAL RD, NGENGPUI",1.6,,,,,
"RIVER NARMADA AT BUDHNIGHAT, BUDHNI DISTRICT SEHORE( M.P.)",1.6,,,,,
"RIVER MOR NEAR PADALSHE, JALGAON",1.6,,,,,
"RIVER MANJRA AT D/S OF LATUR, NEAR LATUR- NANDED BRIDGE, VILLAGE- BHATKHEDA, TALUKA- LATUR, DISTRICT- LATUR.",1.6,,,,,
"RIVER MANDAKINI B/C TO RIVER ALKALNADA AT RUDRAPRAYAG,",1.6,,,,,
RIVER MAHI (D/S) CONF WITH R. CHAP (UNDER SAGWARA-SARHI RD. BDG.),1.6,,,,,
"RIVER KRISHNA AT RAJAPUR WEIR, VILLAGE. RAJAPUR, TALUKA. SHIROL, DISTRICT. KOLHAPUR.",1.6,,,,,
"RIVER KOSI AT DADIYAL BRIDGE, UTTRAKHAND",1.6,,,,,
RIVER HATHNI NANPUR FATA DAM ALIRAJPUR,1.6,,,,,
"RIVER GOMTI AT LUCKNOW D/S PIPRAGHAT , U.P.",1.6,,,,,
"RIVER GANGA U/S, VINDHYACHAL, MIRZAPUR",1.6,,,,,
"RIVER GANGA AT VARANASI D/S , A/C RIVER VARUNA , U.P",1.6,,,,,
"RIVER GANGA AT TARIGHAT (GHAZIPUR), U.P",1.6,,,,,
"RIVER GANGA AT ROAD BRIDGE TARIGHAT,DIST GHAZIPUR (U.P.)",1.6,,,,,
"RIVER GANGA AT KANNAUJ U/S (NEAR MEHNDIGHAT BRIDGE), U.P",1.6,,,,,
"RIVER GANGA AFTER CONFLUENCE OF SONG NEAR SATYANARAYAN TEMPLE D/S RAIWALA, DEHRADUN",1.6,,,,,
"RIVER DIKHOW AT DIKHOW BRIDGE SIVASAGAR, ASSAM",1.6,,,,,
RIVER DHELLA D/S AT THAKURDWARA ALIGANJ ROAD,1.6,,,,,
RIVER DEO AT KANCHANPUR,1.6,,,,,
RIVER DAYA AT KANAS,1.6,,,,,
RIVER D/S OF BIDYADHARI AT MALANCHA BURNING GHAT,1.6,,,,,
"RIVER CHITHE STREAM, NR SIPMUI'S STP, BETHELEM VENGTHLANG",1.6,,,,,
"RIVER CHAMBAL AT KESHORAIPATAN U/S, NEAR SHRI RAJESHWAR MAHADEV TEMPLE, BUNDI",1.6,,,,,
"RIVER CHAMBAL AT DHOLPUR,",1.6,,,,,
RIVER BURHI GANDAK U/S ROAD BRIDGE NH NEAR ZERO MILE MUZAFFARPUR,1.6,,,,,
RIVER BRAHMANI AT ROURKELA FD/S AT ATTAGHAT,1.6,,,,,
"RIVER BHIMA AT NARSINGPUR, (D/S AF.CONFL.WITH R.NIRA), NARSINGPUR, MALSHIROS, SOLAPUR",1.6,,,,,
RIVER BEAS U/S MANDI,1.6,,,,,
RIVER BEAS AT D/S JAISINGHPUR,1.6,,,,,
"RIVER BANJAR AT MALANJKHAND NEAR W/S INTAKE POINT, JABALPUR",1.6,,,,,
RIVER BADA NADI AT ASIKA,1.6,,,,,
POONPUN NEAR POONPUN RAIL BRIDGE,1.6,,,,,
"PENNAR B/c WITH CHITRAVATHI, TADIPATRI, UNGANOOR, ANANTAPURA",1.6,,,,,
"PAWNA AT PIMPRIGAON, PUNE.",1.6,,,,,
NARMADA S.N. 44 NEAE ROAD BRIDGE NEAR JHILKOLI NARSINGPUR,1.6,,,,,
NALABANTA,1.6,,,,,
"MESHWA NEAR RAJASTHAN BORDER AT SAMLAJI,",1.6,,,,,
"MANUSMAR AT PARSHURAMPUR, RIGA BELSUND ROAD,",1.6,,,,,
"MANJRA D/S OF LATUR NEAR LATURNANDED BRIDGE, BHATKHEDA, LATUR",1.6,,,,,
"MAHANADI AT SAMBALPUR U/S, ORISSA",1.6,,,,,
"KIM AT SAHOL BRIDGE, OLPAD HANSOT ROAD, DIST",1.6,,,,,
KHARASROTA AT KHANDITARA (D/S OF INDUSTRIAL ACTIVITY,1.6,,,,,
"KACHCHIDARGAHBIDUPUR ROAD BRIDGE, PATNA",1.6,,,,,
KABINI AT CAUSE WAY SATTUR,1.6,,,,,
"HASDEO RIVER 100 METER DOWNSTREAM AFTER CONFLUENCE OF DENGUR NALLAH NERA C.S.E.B. EAST GUEST HOUSE, KORBA, CHHATISGARH.",1.6,,,,,
"HASDEO AT U/S KORBA,",1.6,,,,,
"GANGA RIVER AT BARAHIYA, NEPALITOLA, MARANCHI, ;LAKSHISARAI",1.6,,,,,
"GANGA AT HARIDWAR D/S, UPPER GANGA CANAL D/S BALKUMARI MANDIR, AJEETPUR, HARIDWAR",1.6,,,,,
GANGA AT GARDEN REACH,1.6,,,,,
GANGA AT ARA- CHAPRA ROAD BRIDGE (KOILWER BANURA - CHAPRA ROAD,1.6,,,,,
"DIKRONG RIVER NEAR BRIDGE AT NH52,",1.6,,,,,
"DHANSIRI RIVER NEAR BRIDGE AT NH-15, DHANSIRI BHALUKMARI JUNGLE, UDALGURI",1.6,,,,,
"DHANSIR, NUTON BASTI",1.6,,,,,
DEVI AT MACCHIGAON,1.6,,,,,
DEVAK RIVER AT UTTERBEHN,1.6,,,,,
"DARNA RIVER AT CHEHEDI PUMPING STATION, CHEHEDI, NASHIK",1.6,,,,,
"D/S OF RUPNARAYAN AT KOLAGHAT, NEAR KOLAGHAT RAIL BRIDGE NO.3,MEDINIPORE",1.6,,,,,
"CONFLUENCE OF BOKARO and DAMODAR RIVER NEAR ZARANGDIH BRIDGE,",1.6,,,,,
"CHOTA TAWA BEFORE CONFL. WITH RIVER NARMADA,M.P.",1.6,,,,,
"CHHAPI AT UPSTREAM OF CHHAPI DAM, JHALAWAR, RAJASTHAN",1.6,,,,,
"CHENAB AT CHADRA GAON VIEW POINT(4 KM U/S FROM SPOT),JandK",1.6,,,,,
"BRAHMANI AT TALCHER FU/s (INTAKE WELL OF MCL, TALC",1.6,,,,,
BRAHAMPUTRA AT DIBRUGARH,1.6,,,,,
"BHADRA AT U/S OF KIOCL,",1.6,,,,,
BEAS AT G.T.ROAD UNDER BDG. NEAR KAPURTHALA,1.6,,,,,
"BARALIA RIVER (NEAR CHATPUJA GHAT) RANGIA, KAMRUP (R )",1.6,,,,,
"BANAS,DHANARI DAM, NEAR SWAROOPGANJ, SIROHI",1.6,,,,,
"BANAS,BISULPUR DAM, TONK",1.6,,,,,
AKRAVATHI RIVER BEFORE CONFLUENCE AT SANGAM,1.6,,,,,
"RIVER YAMUNA AT ETAWAH, U.P.",1.583333333,,,,,
RIVER PABBAR AT U/S DHAMBARI,1.583333333,,,,,
"RIVER MANU AT MANUGHAT, CONFL POINT OF CHAWMANU CHARRA and MANU RIVER, DHALAI",1.583333333,,,,,
"RIVER KATHAKAL U/S AT MATIJURI, DIST. HAILAKANDI, ASSAM",1.583333333,,,,,
"RIVER BURHIDIHING NEAR DULIAJAN AT D/S, TINSUKIA, ASSAM",1.583333333,,,,,
"ANAS AT DAHOD, (KUSHALGARH), DIST. PANCHMAHAL",1.583333333,,,,,
"VAIPUANPHO STREAM, AILAWNG, MAMIT DIST.",1.575,,,,,
U/S OF WEIR SITE OF WTP NEAR ASHWANI BRIDGE,1.575,,,,,
TAWI AT BAGHEBAHU LIFTING POINT(1 KM U/S TAWI BRIDGE),1.575,,,,,
"TAPI AT KATHORE, (NH8 BRIDGE)",1.575,,,,,
"SHIMSHA AT D/S OF HIGHWAY BRIDGE, YEDIYAR,",1.575,,,,,
"SHIMSHA AT D/S OF HIGHWAY BRIDGE, YEDIYAR",1.575,,,,,
"RIVER YAMUNA AT PRAYAGRAJ D/S (BALUA GHAT), U.P.",1.575,,,,,
"RIVER SUTLEJ D/S OLINDA, NEAR BHAKRA DAM, H.P.",1.575,,,,,
"RIVER SARABANGA AT EDAPADI AT SALEM, D/S OF TEXTILE DYEING INDUSTRIES EFFLUENT, TAMILNADU",1.575,,,,,
RIVER NARMADA RIVER AT SEMALDA U/S OF BARWANI,1.575,,,,,
"RIVER KINNERASANI (TRIBUTRARY OF GODAVARI) - KINNERASANI AFTER CONFLUENCE OF KTPS ASH POND EFFLUENTS ,BHADRADRI KOTHAGUDEM",1.575,,,,,
"RIVER GODAVARI - U/S AT BHADRACHALAM BATHING GHAT, BHADRADRI KOTHAGUDEM",1.575,,,,,
"RIVER GHAGHARA AT TURTIPAR,DEORIA D/S, U.P.",1.575,,,,,
"RIVER GANGA AT U/S BRIJ GHAT ,GHARMUKTESHWAR",1.575,,,,,
"RIVER CHOUPAN U/S AT VIJAYPUR , GUNA",1.575,,,,,
MAHANADI MUHANA NORTH (5 KM FROM SHORE),1.575,,,,,
GODAVARI RIVER AT U/S OF PAITHAN AT PAITHAN INTAKE PUMP HOUSE AT JAYAKWADI .,1.575,,,,,
"GODAVARI AT POLAVARAM, WEST GODAVARI DISTRICT",1.575,,,,,
GHATPRABHA AT D/S OF MUDHOL RD. CROSS BDG.,1.575,,,,,
"CAUVERY AT SRI RANGAPATTANNA,D/S OF ROAD BDG.,KARNATAKA",1.575,,,,,
"CAUVERY AT SRI RANGAPATTANNA, D/S OF ROAD BDG.,",1.575,,,,,
BRAHMPUTRA AT DHENUKHAPAHAR,1.575,,,,,
RIVER TIKIRA AT KANIHA D/S,1.566666667,,,,,
RIVER TAPI AT NEPANAGAR,1.566666667,,,,,
"RIVER MAHANANDA AT THAKURGANJ, KISHANGANJ ROAD BRIDGE, KISHANGANJ",1.566666667,,,,,
"RIVER MAHANANDA AT SILIGURI, DARJEELING",1.566666667,,,,,
RIVER DEVAK AT UTTERBEHNI,1.566666667,,,,,
"DAHA RIVER AT ITWA BRIDGE, SIWAN",1.566666667,,,,,
BHIMA AT TAKLI,1.566666667,,,,,
YAMUNA D/S AGRA,1.55,,,,,
"VASISTA AT SALEM, D/S OF SAGO INDUSRIES EFFLUENT",1.55,,,,,
VAMSADHARA AT MUNIGUDA (D/S OF M/S VEDANTAALUMINA PROJECT),1.55,,,,,
"U/S MANUSMAR RIVER (RIGA), SITAMARHI",1.55,,,,,
SWAN RIVER U/S SANTOSHGARH BRIDGE,1.55,,,,,
SONE NEAR BHANVARSEN ROAD BRIDGE AFTER CONFLUENCE,1.55,,,,,
"SONE AT ORIGINE AMARKANTAK, M.P",1.55,,,,,
SIRSIYA AT RAXAUL,1.55,,,,,
"SHIMSHA D/S OF HIGHWAY BRIDGE, YEDIYAR",1.55,,,,,
"SEONATH AT SHIMGA AFTER CONFL. WITH R. KHAROON,",1.55,,,,,
SATLUJ U/S HEAD WORKS ROPAR,1.55,,,,,
"RUPNARAYAN BEFORE CONFL. TO RIVER GANGA NEAR GEONKHALI,MEDINIPORE, WEST BENGAL",1.55,,,,,
"RIVER YAMUNA AT MATHURA U/S ,NEAR GAUGHAT U.P.",1.55,,,,,
"RIVER WENA AT U/S OF MOHATA MILLS, NEAR RAILWAY BRIDGE ON WARDHA, CHANDRAPUR RAILWAY LINE, VILLAGE- HINGANGHAT, TALUKA- HINGANGHAT, DISTRICT- WARDHA.",1.55,,,,,
"RIVER WARDHA AT U/S OF ERAI RIVER AT HADASTI NEAR ARUN ENGG. WORKS, VILLAGE- HADASTI, TALUKA- CHANDRAPUR, DISTRICT- CHANDRAPUR.",1.55,,,,,
"RIVER WARDHA AT RAJURA BRIDGE, VILLAGE- RAJURA, TALUKA- CHANDRAPUR",1.55,,,,,
RIVER SUTLEJ AT JALANDHAR U/S (PEERU SHAH KA DARGA,1.55,,,,,
"RIVER SIRSIYA AT RAXAUL, EAST CHAMPARAN",1.55,,,,,
"RIVER RUPNARAYAN BEFORE CONFL. TO GANGA NEAR GEONKHALI,MEDINIPORE, WEST BENGAL",1.55,,,,,
RIVER RAIDAK AT ALIPURDUAR,1.55,,,,,
"RIVER PILKHAR AT RAMPUR, BHOT(U.P)",1.55,,,,,
"RIVER PARVATI D/S AFTER VINDHYACHAL NALLA AT PILUKHEDI,RAJGARH",1.55,,,,,
RIVER NARMADA NEAR W/S INTAKE JALLOD,1.55,,,,,
RIVER NARMADA AT UP- STREAM OF VILLAGE JAIT NEAR NARYANAPURA DISTRICT SEHORE (M.P.),1.55,,,,,
"RIVER NANDOUR U/S AT SITARGANJ INDUSTRIAL AREA, US NAGAR",1.55,,,,,
RIVER MANU AT MANUBAZAR,1.55,,,,,
RIVER MANDA (DUDHNOI RIVER) AT WAGEASI,1.55,,,,,
"RIVER KRISHNA BEFORE CONFLUENCE OF RIVER MUSI AT WADAPALLY (V), DAMARACHARLA (M), NALGONDA (D)",1.55,,,,,
"RIVER KINNERASANI (TRIBUTRARY OF GODAVARI) - U/S OF KARAKAVAGU AT PALONCHA , BHADRADRI KOTHAGUDEM",1.55,,,,,
"RIVER KALIASOT DAM OUTLATE NEAR DAM GATE,BHOPAL",1.55,,,,,
"RIVER KALI SINDH AT ANICUT OF M/S CFCL GADEPAN, KO",1.55,,,,,
"RIVER INDRAYANI AT U/S OF MOSHIGAON, HAWELI, PUNE",1.55,,,,,
"RIVER GODAVARI - D/S AT KAMALAPUR ,AT M/S.AP RAYONS LTD., DISCHARGE POINT , MANGAPET (VandM), MULUGU (D)",1.55,,,,,
RIVER GIRI U/S PROPOSED SITE OF SRI RENUKAJI DAM SITE.,1.55,,,,,
"RIVER GANGA TA GULABI GHAT, PATNA",1.55,,,,,
"RIVER GANGA AT D/S NAWADAGHAT , BARH ,PATNA",1.55,,,,,
"RIVER DHELLA U/S AT KASHIPUR MORADABAD ROAD BRIDGE,US NAGAR",1.55,,,,,
RIVER CHURNI AT BIJOYPUR (WEST BENGAL),1.55,,,,,
"RIVER CHAMBAL AT JANAPAWA, FROM ORIGIN POINT, INDORE",1.55,,,,,
"RIVER CHAMBAL AT GANDHI SAGAR DAM, RAMPURA, M.P",1.55,,,,,
"RIVER BURHI GANDAK AT BARACHAKIA, EAST CHAMPARAN",1.55,,,,,
RIVER BRAHMANI AT KAMALANGA (TALCHER D/S),1.55,,,,,
"RIVER BHIMA AT DAUND NEAR MAHADEV TEMPLE,VILLAGE- DAUND, TALUKA- DAUND,",1.55,,,,,
"RIVER BHANWAR SEMLA DAM NEAR VILLAGE- DHOPAL,",1.55,,,,,
"RIVER BHADRA AT D/S OF BHADRAVATHI,",1.55,,,,,
RIVER AJAY AT MASANJORE DAM,1.55,,,,,
"PEDHI RIVER NEAR ROAD BRIDGE AT DADHIPEDHI VILLAGE, BHATKULI, AMRAVATI",1.55,,,,,
NARMADA NEAR ROAD BRIDGE JHANSINGHAT JABALPUR,1.55,,,,,
"NARMADA AT NEAR ROAD BRIDGE, SANDIA",1.55,,,,,
KRISHNA AT HAMSALADEEVI PULIGADDA AQUEDUCT NEAR,1.55,,,,,
"KOLAR DAM WATER SUPPLY INTAKE WELL, DISTT. SEHORE,",1.55,,,,,
KATNI NEAR NAGAR NIGAM,1.55,,,,,
KANIHA U/S,1.55,,,,,
JAGJITPUR,1.55,,,,,
HASDEO D/S NEAR URGA VILLAGE KORBA,1.55,,,,,
GODAVARI RIVER AT D/S OF PAITHAN AT PATHEGAON BDG,1.55,,,,,
"GODAVARI AT RAJAHMUNDRY D/s DHAVALESWARAM, EAST GODAVARI",1.55,,,,,
"GANGA NEAR DANAPUR (NEAR PIPA PUL) ,PATNA",1.55,,,,,
GANGA AT U/S MUNGER,1.55,,,,,
DHELA D/S AT THAKURDWARA ALIGANJ ROAD,1.55,,,,,
"CAUVERY AT VAIRAPALAYAM, NAMAKAL,",1.55,,,,,
CAUVERY AT AJJIBORE (BANGALORE),1.55,,,,,
"BURHI GANDAK AT KHAGARIA ROAD BRIDGE, KHAGARIA",1.55,,,,,
"BORSILA RIVER AT BORSILA, DEOPANI, NAMTI",1.55,,,,,
BINJHARPUR,1.55,,,,,
BAITARNI RIVET AT TRIBINDHA,1.55,,,,,
RIVER GANGA D/S NEAR CREMATION GHAT,1.5375,,,,,
BANER KHAD D/S CHAMUNDA TEMPLE,1.5375,,,,,
RIVER SUTLEJ AT D/S RAMPUR,1.533333333,,,,,
"RIVER GANGA AT BUXAR, RAMREKHAGHAT",1.533333333,,,,,
"RIVER DORIKA NEAR MSW DUMPING SITE, SIVASAGAR",1.533333333,,,,,
RIVER BINWA AT D/S PAPROLA/BAIJNATH,1.533333333,,,,,
RIVER BAITARNI AT TRIBINDHA,1.533333333,,,,,
JHELUM RIVER AT PAMPORE,1.533333333,,,,,
"BHIMA AT D/S OF ROAD BRIDGE AT GANGAPUR VILLAGE,",1.533333333,,,,,
YAMUNA AT SONEPAT,1.525,,,,,
"SONE RIVER NEAR BANZARI, ROHTAS",1.525,,,,,
"RIVER YAMUNA AT JUHIKA B/C WITH CHANBAL, ETAWAH, U.P",1.525,,,,,
"RIVER YAMUNA AT BATESWAR, U.P",1.525,,,,,
"RIVER YAMUNA AT AGRA U/S, U.P.(KAILASH GHAT)",1.525,,,,,
"RIVER TUIRIAL D/S, HEPP DAM, SAIPUM, KOLASIB DIST.",1.525,,,,,
RIVER SUTLEJ BEFORE CONFLUENCE WITH GANVI KHAND,1.525,,,,,
"RIVER SONE UPSTREAM TOWARDS DEORA, DIST- SINGRAULI (M. P.)",1.525,,,,,
"RIVER SEONATH AT MOHAD, RAJNANDGAON",1.525,,,,,
RIVER RAVI D/S CHAMERA- III HEP DAM,1.525,,,,,
RIVER RAVI CHAMERA-I RESERVOIR,1.525,,,,,
RIVER PARVATI BEFORE CONF. TO RIVER BEAS AT BHUNTER,1.525,,,,,
"RIVER NIRA AT SAROLA BRIDGE, VILLAGE- SAROLA, TALUKA-BHOR, DISTRICT- PUNE.",1.525,,,,,
"RIVER NARMADA AT NAVAGAM, NEAR GORA COLONY, KEVADIA, GUJARAT (GUJARAT AND MADHYA PRADESH)",1.525,,,,,
"RIVER MESHWA NEAR RAJASTHAN BORDER D/S AT SAMLAJI,DIST: ARVALI",1.525,,,,,
RIVER MAHANADI AT SAMBALPUR FD/S AT HUMA,1.525,,,,,
"RIVER MAHANADI AT RUDRI RESERVOIR U/S AT RUDRI,DHAMTARI",1.525,,,,,
"RIVER GODAVARI AT RAMAGUNDAM UPSTREAM NEAR DAM, PEDDAPALLI",1.525,,,,,
"RIVER GANGA AT VARANASI U/S NEAR VISHWASUNDARI BRIDGE B/C DRAINS( NAGWA NALA, SAMNE GHAT NALA,NAKHHI NALA)",1.525,,,,,
"RIVER GANGA AT PRAYAGRAJ (RASOOLABAD), U.P.",1.525,,,,,
"RIVER GANGA AFTER CONFLUENCE OF RIVER BHAGIRATHI AND RIVER ALAKNANDA AT DEVPRAYAG ,DIST-TEFRI GARHWAL",1.525,,,,,
RIVER GANDAK AT SONEPUR NEAR HARIHARNATH TEMPLE,1.525,,,,,
"RIVER DIKRONG NEAR BRIDGE AT NH-52, BANDARDEWA",1.525,,,,,
"RIVER CHAMBAL AT RAMESHWARGHAT NR. SAWAIMADHOPUR, RAJASTHAN",1.525,,,,,
"GODAVARI AT RAJAHMUNDRY D/s, DHAVALESWARAM, EAST GODAVARI",1.525,,,,,
BRAHMAPUTRA AT DHUBRI,1.525,,,,,
BEAS AT D/S PONG DAM,1.525,,,,,
ASHWANI KHAD U/S OF SADHUPUL VILLAGE (NEARBY 800 METERS U/S OF THE BRIDGE),1.525,,,,,
SWAN RIVER D/S GAGRET,1.516666667,,,,,
"SATLUJ AT BRIDGE HARIKE, AMRITSAR",1.516666667,,,,,
"RIVER NARMADA AT JAMTARA, NEAR RAILWAY BRIDGE",1.516666667,,,,,
RIVER NARMADA AT HANUWANTIA DIST. KHANDWA,1.516666667,,,,,
RIVER BAITARNI AT JAJPUR,1.516666667,,,,,
MOL KHAD U/S PALAMPU,1.516666667,,,,,
