Year,AVERAGE of BOD_Avg,AVERAGE of DO_Avg,,,,
2012,5.25742,7.130933333,,,,
2013,10.15557123,6.956734838,,,,
2014,8.356213389,5.873500697,,,,
2016,4.767815421,6.71103972,,,,
2017,2.397955801,6.878508287,,,,
2018,5.57420999,6.000214067,,,,
2019,4.80215101,6.345329236,,,,
2020,2.712875622,6.948731343,,,,
2021,2.382383242,7.526277473,,,,
2022,4.695617128,7.442981738,,,,
2023,3.048387097,6.810533499,,,,
Grand Total,4.513564601,6.853971241,,,,
,,,,,,
,,,,,,
State Name,AVERAGE of DO_Avg,AVERAGE of BOD_Avg,,,,
Rd_Bangalore,7.65,1.55,,,,
Tripura,7.944230769,1.788461538,,,,
Mizoram,7.401515152,2.701515152,,,,
Sikkim,7.603731343,2.73358209,,,,
Puducherry,7.735714286,2.771428571,,,,
Punjab,6.958450704,3.034929577,,,,
Telangana,7.09765625,3.230078125,,,,
Odisha,7.029613842,3.339468405,,,,
Inter-State,6.45483871,3.432258065,,,,
Nagaland,7.052348993,3.432550336,,,,
Bihar,6.942049763,3.582819905,,,,
Rajasthan,6.86875,3.633552632,,,,
Uttar Pradesh,7.083465704,3.635258724,,,,
Tamil Nadu,6.990790123,3.98654321,,,,
Jharkhand,6.702238806,3.995373134,,,,
Gujarat,6.935384615,4.025213675,,,,
Jammu and Kashmir,6.990149626,4.344014963,,,,
Meghalaya,6.925986842,4.375328947,,,,
Andhra Pradesh,6.905702918,4.467241379,,,,
Chhattisgarh,6.8177,4.516516667,,,,
Maharashtra,6.502985075,4.719282753,,,,
Delhi,6.8,4.78,,,,
West Bengal,6.873159145,4.816389549,,,,
Madhya Pradesh,6.603511375,4.845548961,,,,
Arunachal Pradesh,7.266935484,5.202419355,,,,
Himachal Pradesh,7.037945571,5.440298826,,,,
Kerala,5.961111111,5.55,,,,
Uttarakhand,6.691590214,5.825229358,,,,
Assam,6.702640545,5.944974446,,,,
Karnataka,6.625283019,6.646981132,,,,
Manipur,6.500096154,7.144230769,,,,
Haryana,7.124576271,8.017457627,,,,
Grand Total,6.853971241,4.513564601,,,,
,,,,,,
,,,,,,
State Name,SUM of Pollution Flag,,,,,
Maharashtra,180,,,,,
Madhya Pradesh,166,,,,,
Karnataka,146,,,,,
Himachal Pradesh,127,,,,,
Assam,107,,,,,
Uttar Pradesh,91,,,,,
Bihar,90,,,,,
West Bengal,83,,,,,
Odisha,81,,,,,
Jammu and Kashmir,53,,,,,
Uttarakhand,52,,,,,
Gujarat,52,,,,,
Chhattisgarh,45,,,,,
Andhra Pradesh,44,,,,,
Tamil Nadu,39,,,,,
Jharkhand,34,,,,,
Punjab,32,,,,,
Telangana,21,,,,,
Meghalaya,20,,,,,
Nagaland,19,,,,,
Delhi,19,,,,,
Rajasthan,13,,,,,
Manipur,11,,,,,
Haryana,11,,,,,
Arunachal Pradesh,8,,,,,
Mizoram,6,,,,,
Kerala,6,,,,,
Sikkim,3,,,,,
Inter-State,3,,,,,
Puducherry,1,,,,,
Tripura,0,,,,,
Rd_Bangalore,0,,,,,
Grand Total,1563,,,,,
,,,,,,
,,,,,,
Year,AVERAGE of pH_Avg,AVERAGE of Nitrate_Avg,,,,
2014,13.94090656,231.6932985,,,,
2022,11.33447733,1.782871222,,,,
2020,7.847950249,2.302993532,,,,
2013,7.843554302,1.858363893,,,,
2019,7.827870939,2.748080334,,,,
2016,7.804077103,3.775172313,,,,
2021,7.70998283,1.441653503,,,,
2012,7.648253333,1.408173333,,,,
2017,7.603823204,2.40601326,,,,
2023,7.558886476,1.147497208,,,,
2018,7.537227319,2.180148471,,,,
Grand Total,8.573273169,16.06674387,,,,
,,,,,,
,,,,,,
AVERAGE of BOD_Avg,State Name,,,,,
Year,Uttarakhand,Kerala,Delhi,Maharashtra,Gujarat,Bihar
2012,6.622727273,7.15,3,3.153458333,5.695,4.502564103
2013,4.4075,12.575,13.08333333,8.071428571,6.109375,7.051612903
2014,29.22368421,3.125,2.738888889,3.760416667,8.3,5.325
2016,10.96346154,1.6,1.533333333,2.519747899,2.077631579,1.656451613
2017,1.522916667,1.625,1.675,1.811206897,1.595714286,2.304861111
2018,1.812903226,14.2,16.15,7.144761905,8.867142857,6.821126761
2019,8.915789474,5.4,1.675,5.087878788,3.507142857,3.571428571
2020,1.733333333,2.3,1.925,1.720833333,2.495833333,2.814673913
2021,3.78,2.25,0.5375,3.6125,1.040243902,0.7675531915
2022,1.492105263,9.19,1.871428571,9.41699187,3.330681818,3.486458333
2023,3.594318182,1.858333333,5.4,2.95387931,6.935227273,3.252083333
Grand Total,5.825229358,5.55,4.78,4.719282753,4.025213675,3.582819905
,,,,,,
,,,,,,
Pollution Category,COUNTA of Pollution Category,,,,,
Good,8058,,,,,
Moderate,2097,,,,,
Polluted,1563,,,,,
Grand Total,11718,,,,,
,,,,,,
,,,,,,
Monitoring Location,AVERAGE of BOD_Avg,,,,,
"SATLUJ B/C WITH RIVER SPITI AT KHAB, DISTT.KINNAUR, H.P.",176,,,,,
"RIVER WARDHA AT D/S OF ERAI RIVER, HADASTI, CHANDRAPUR, CHANDRAPUR",147.5,,,,,
"RIVER PANCHAGANGA AT U/S OF KOLHAPUR TOWN NEAR BALINGA PUMPING STATION, VILLAGE- BALINGA, TALUKA- KARVIR, KOLHAPUR.",132,,,,,
"RIVER GODAVARI AT DHALEGAON, VILLAGE- DHALEGAON, TALUKA- PATHARI,",123.5,,,,,
RIVER SUTLEJ AFTER CONFLUENCES OF RIVER BASPA,120.9,,,,,
"RIVER MULA-MUTHA AT D/S OF THEUR, VILLAGE. THEUR, TALUKA. HAWELI, DISTRICT. PUNE.",103.375,,,,,
"BETWA AT NAYAPUR D/S MANDIDEEP INDL. AREA NO.1, DISTRICT RAISEN",84,,,,,
"YAMUNA AT SONEPAT, HARYANA",80.13333333,,,,,
"RIVER WARDHA AT CONFLUENCE POINT OF PENGANGA and WARDHA. VILLAGE. JUGAD, TALUKA. WANI, DISTRICT. YAVATMAL.",72.375,,,,,
DEVAK AT UTTERBEHNI.,71.3,,,,,
RAVI D/S CHAMERA III HEP,71,,,,,
SONE AT DEVLOAD OUT LET OF BANSAGAR DAM,69,,,,,
"GANGA AT DIAMOND HARBOUR, WEST BENGAL",69,,,,,
"JHELUM ATSPORE, CONFLUENCE POINT OF WULAR LAKE",68.5,,,,,
JHELUM D/S ATBARAMULLA,67.5,,,,,
"CHAMBAL AT DHOLPUR, M.P",63.5,,,,,
BANOI KHAD AT KALAPUL ON CANT ROAD DHARAMSHALA,62.5,,,,,
"MAHANADI AT CUTTACK D/S, ORISSA",62,,,,,
BETWA D/S AFTER MIXING OF BAIS AT VIDISHA,62,,,,,
GHATPRABHA D/S OF MUDHOL RD. CROSS BDG,61.5,,,,,
DAMODAR AT D/S OF IISCO AFTER 3RD OUTFALL AT DHENNA VILLAGE,61.35,,,,,
MOL KHAD U/S PALAMPUR,61,,,,,
MALPRABHA AT D/S OF AIHOLE TOWN,61,,,,,
GIRI D/S YASHWANT NAGAR,61,,,,,
BHOGDOI RIVER AT JORHAT,60.9,,,,,
DIKHOW RIVER AT DIKHOW BRIDGE SIVASAGAR,58.33333333,,,,,
RIVER GANGA AT HAR- KI-PAURI GHAT,58,,,,,
RIVER THOUBAL AT LITAN BRIDGE,57.6,,,,,
"SATLUJ AT U/S TATAPANI, H.P.",57.15,,,,,
"SAI AT JALALPUR, JAUNPUR",55.1875,,,,,
"MAHANADI AFTER CONFL. WITH R.TEL (SONEPUR D/S),ORISSA",55,,,,,
HEMAVATI D/S OF HOLENARASIPURA TOWN AT RAMADEVALA WEIR,55,,,,,
"RIVER GIRI AT NIHARI, KOTKHAL",52.95,,,,,
"KAMENG RIVER AT TIPPI, BHALUKPONG",52.4,,,,,
RIVER NARMADA NEAR ROAD BRIDGE JHANSINGHAT JABALPUR,51.81666667,,,,,
BHADRA AT MALLESWARAM D/S OF KIOCL KARNATAKA,51.25,,,,,
"RIVER INDRAYANI AT D/S OF ALANDIGAON, VILLAGE. ALANDIGAON, TALUKA. HAWELI, DISTRICT. PUNE.",50.3,,,,,
MALPRABHA AT D/S OF KHANAPUR VILLAGE,50,,,,,
"RIVER GODAVARI AT BHADRACHALAM D/S BATHING GHAT, KHAMMAM",48.5,,,,,
"CAUVERY AT SRIRANGA PATTANNA, D/S OF ROAD BDG",47,,,,,
"RIVER WARDHA AT D/S OF ACC LTD. GHUGGUS NEAR WCL PUMP HOUSE, VILLAGE- GHUGGUS, TALUKA- CHANDRAPUR, DISTRICT- CHANDRAPUR.",46,,,,,
"WARDHA AT RAJURA BRIDGE, MAHARASHTRA",45.75,,,,,
RIVER THOUBAL AT SHONG KONG,44.7,,,,,
"NANDAUR U/S SITARGANJ INDUSTRIAL AREA, US NAGAR",44.5,,,,,
RIVER GHATPRABHA DAVALSHWAR BARRAGE JACKWELL FOR DRINKING WATER SUPPLY,44,,,,,
"TAPI AT SURAT U/S KATHORE, GUJARAT",43.625,,,,,
"RIVER TONS AT BASAMAN MAMA TEMPLE, NEAR PURWA FALL, TEHSIL- SEMARIYA, DIST- REWA",43.5,,,,,
WATER SUPPLY INTAKE POINT TO MYSORE PUMP HOUSE,42.2,,,,,
"KUAKHAI AT BHUBANESWAR U/S, ORISSA",42,,,,,
LAKSHMANTIRTHA AT D/S OF KATTEMALAVADI,41.25,,,,,
"RIVER SINDH AT DABRA, M.P",40.41666667,,,,,
"RIVER SINA NEAR LABOTI TOLL NAKA, VILLAGE. LABOTI, TALUKA. MOHAL, DISTRICT. SOLAPUR.",40.025,,,,,
"MANDAKINI B/C ALKALNADA AT RUDRAPRAYAG, UTTAR PRADESH",40,,,,,
RIVER MANER AT WARANGAL U/S (MANERU AT THUMMALA CHERUVU/MADANNAPET),39.5,,,,,
SUBANSIRI AT GEREKAMUKH (B/C WITH BRAH.),39.25,,,,,
RAVI U/S CHAMBA,38.65,,,,,
RIVER IRANG AT TAMENGLONG,38.6,,,,,
"CAUVERY AT THIRUMUKKUDAL-CONFL. PT.OF R. AMRAVATI,TAMILNADU",38.325,,,,,
"SHANKNI A/C DANKANI,DANTEWADA.",38,,,,,
MANDAKINI AT CHITRAKUT,38,,,,,
"BHIMA AT D/S OF ROAD BRIDGE AT GANGAPUR VILLAGE,KARNATAKA",37.625,,,,,
"RIVER BARNADI NEAR BRIDGE, NH-52,",36.8,,,,,
"DHANSIRI AT GOLAGHAT, ASSAM",36.40833333,,,,,
"SWAN AT D/S NANGAL, UNA",36,,,,,
JHELAM AT CHATTABAL WEIR (OUTLET),35.7,,,,,
PURI U/S MALATIPATPUR,35.5,,,,,
MANDAKINI B/C ALKALNADA AT RUDRAPRAYAG,34.9,,,,,
"GODAVARI AT RAJAHMUNDRY D/S, A.P.",34.7,,,,,
"RIVER NARMADA AT LALPUR, JABALPUR",34.55,,,,,
"RAVI AT U/S MADHOPUR, H.P.",34.55,,,,,
SHANKNI RIVER A/C DANKANI RIVER DANTEWADA.,34.1,,,,,
"BASANTER AT SAMBA (BELOW NH-1A BRIDGE), BASANTAR US (R.H.S),JandK",33.85,,,,,
"RIVER URMODI AT NAGTHNE KT WARE, VILLAGE- NAGTHANE,TALUKA- SATARA, DISTRICT- SATARA.",33.75,,,,,
"GODAVARI AT RAJAHMUNDRY U/S, A.P.",33.61666667,,,,,
RIVER UMIAM MAWPHLANG AT NONGKREM,33.5,,,,,
DWARAKESHWAR WATER INTAKE POINT FOR BANKURA TOWN,33.5,,,,,
"RIVER CAUVERY D/S OF AT DUBARE, HANGING BRIDGE (THEPPA DA KINDI)",33.25,,,,,
PARVATI BEFORE CONF. TO BEAS,33,,,,,
"YAMUNA AT U/S OF LAKHWAR DAM, U.P",32.95,,,,,
"DISANG RIVER AT DILLIGHAT, DIBRUGARH DIST., ASSAM",32.7375,,,,,
"RIVER NANDOUR D/S AT SITARGANJ INDUSTRIAL AREA, US NAGAR",32.625,,,,,
"GODAVARI AT RAHER, MAHARASHTRA",32.6,,,,,
"RIVER GODAVARI AT NANDUR- MADHMESHWAR DAM, VILLAGE- NANDUR, TALUKA- NIPHAD",32.5,,,,,
PURI AT GOLASAHI,32,,,,,
KOEL AT MANOHARPUR AFTER MEETING KOINA RIVER D/S,32,,,,,
"KRISHNA AT TINTINI BRIDGE, KARNATAKA",31.73333333,,,,,
"BAITARNI AT ANANDPUR, ORISSA",31.5,,,,,
RIVER HEMAVATHI AT D/S OF HOLENARASIPURA TOWN AT RAMADEV WEIR,31.475,,,,,
"NAO DIHING RIVER AT NAMSAI,",31.25,,,,,
"GANGA AT DAKSHMINESWAR, WEST BENGAL",31.2,,,,,
"DIGBOI RIVER AT LAKHIPATHE, RESERVE FOREST, DIGBOI, ASSAM",30.975,,,,,
"BHAGIRATHI B/C WITH ALAKNANDA AT DEVPRAYAG, U.P",30.85,,,,,
"RIVER IMPHAL NEAR LEIKINTHABI ROAD, AWANG SEKMAI",30.75,,,,,
"GODAVARI AT POLAVARAM, A.P.",30.71666667,,,,,
RIVER TUNGABHADRA AT U/S OF HARIHAR POLYFIBERS,30.575,,,,,
"HASDEO AT U/S OF CHAMPA,CHHATISSGARH",30.525,,,,,
RIVER YAMUNA D/S RANBAXY,30.5,,,,,
KOSHI RIVER AT BEERPUR,30.4375,,,,,
"RIVER BETWA NEAR WATER SUPPLY INTAKE WELL , VIDISHA( M.P)",30.15,,,,,
"SUSWA AT MOTHRAWALA, DEHRADUN",30.05,,,,,
RIVER NARMADA NEAR SHAHGANJ GUEST HOUSE DISTRICT SEHORE,30,,,,,
LINGIRA U/S OF ANGUL,29.55,,,,,
"RIVER GODAVARI AT JAYAKWADI DAM, PAITHAN,AURANAGABAD",29.5,,,,,
"CHAMBAL AT GANDHI SAGAR DAM, RAMPURA",29.5,,,,,
BETWA D/S BEENA,29.5,,,,,
"SATLUJ AT D/S BHAKHRA, H.P.",29.35,,,,,
RIVER SWAN U/S UNA TOWN GHALLUWAL BRIDGE,29.35,,,,,
RIVER SABARMATI AT DHAROI DAM,29.35,,,,,
RIVER GIRI AT U/S CCI MINES AT VILLAGE NADI,29.225,,,,,
RUSHIKULYA AT ASKA,29,,,,,
KABBANI AT SARAGUR VILL. D/S,29,,,,,
"CAUVERY AT BANNUR BRIDGE, KARNATAKA",28.95,,,,,
"BURIDIHING NEAR DULIAJAN AT D/S, TINSUKIA, ASSAM",28.9,,,,,
"TUNGHA AT D/S OF SHIMOGA TOWN, KARNATAKA",28.66666667,,,,,
POWER CHANNELU/S,28.5,,,,,
"HASDEO RIVER 100 METER D/S A/C OF DENGUR NALLAH NERA C.S.E.B. EAST GUEST HOUSE, KORBA",28.5,,,,,
CAUVERY AT SATHYAGALAM BDG,28.5,,,,,
"RIVER KELWARA RESERVIOR, N/V KELWARA, TEHSIL- KUMBHALGARH DIST- RAJSAMAND, (UPSTREAM OF KHARI RIVER)",28.43333333,,,,,
"RIVER TLAWNG MID STREAM, REIEK KAI, AIZAWL, U/S OF TLAWNG BRIDGE",28,,,,,
SINDH AT SONAMARG U/S,27.675,,,,,
"KOEL AT MANOHARPUR AFTER MEETING KOINA RIVER D/S,",27.6,,,,,
"BRAHAMPUTRA AT KHERGHAT (AFTER CONFL. WITH DIBANG and DIHANG),ASSAM",27.55,,,,,
"RIVER D/S OF TARAPITH ON DWARKA, SATIGHAT",27.15,,,,,
"RIVER CAUVERY D/S BHARACHUKI FALLS, SATHEGALA, KOLLEGALA",27,,,,,
"PENNAR AFTER CONF. WITH PAPAGNI,PUSPAGINI",27,,,,,
MALPRABHA AT BADAMI BRIDGE,27,,,,,
RIVER IMPHAL AT SAMUROU,26.8,,,,,
BURHIDIHING RIVER AT DULIAJAN (INTAKE POINT OF OIL INDIA LTD.),26.75,,,,,
CAUVERY AT WATER SUPPLY INTAKE POINT AT KOLLEGALA DASANAPURA,26.725,,,,,
"KRISHNA AT D/S OF NARAYANPURA DAM,KARNATAKA",26.65,,,,,
"RIVER CAUVERY D/S AT KANIVE RAMALINGESWARA TEMPLE BRIDGE, KUSHALANAGAR",26.6,,,,,
"BRAHMPUTRA NR WATER INTAKE POINT AT KACHARIGHAT, PANBAZAR, GUWAHATI",26.5,,,,,
PABBAR U/S ROHRU,26,,,,,
"GODAVARI AT RAMAGUNDAM D/S, NR FCI INTAKE WELL, KARIMNAGAR",26,,,,,
PILKHAR AFTER BILASPUR RAMPUR,25.8,,,,,
RAVI AT D/S OF CHAMBA TOWN,25.43571429,,,,,
"SATLUJ AT U/S SLAPPER, H.P.",25.4,,,,,
"GOMAI RIVER, D/S. OF SHAHADA, DHULE.",25.4,,,,,
"TUNGABHADRA AT D/S OF HPF, KARNATAKA",25.26666667,,,,,
RIVER CAUVERY D/S OF KUSHALANAGAR TOWN,25.1,,,,,
"ANAS AT DAHOD, (KUSHALGARH), DIST. PANCHMAHAL, GUJ",24.8,,,,,
"RIVER D/S OF SILABATI AT GHATAL, MEDINIPORE(W)",24.775,,,,,
AMRAVATI AT 1KM D/S FROM EFF.DIS. PT. AT MADHUTHUKKULAM,24.6375,,,,,
BEAS AT D/S PANDOH DAM,24.6125,,,,,
"GODAVARI AT U/S OF GANGAPUR DAM,NASIK,MAHARASHTRA",24.6,,,,,
"BEAS AT D/S MANDI, H.P.",24.6,,,,,
"KHAROON RIVER BUNDRI, RAIPUR",24.58333333,,,,,
"DIKHOW RIVER AT NAGINI MORA (INTERSTATE BOUNDARIES, ASSAMNAGALAND)",24.5,,,,,
"RIVER MUTHA AT SANGAM BRIDGE NEAR GANAPATHYGHAT, VILLAGE . SHIVAJI NAGAR, TALUKA. PUNE, DISTRICT. PUNE.",24.2,,,,,
GANDAK AT GOPALGANJ - PIPRA KOTHI RD BDG (DUMARIA GHAT),24,,,,,
BEAS U/S MANALI,24,,,,,
RIVER CAUVERY AT WATER SUPPLY INTAKE POINT AT TORE KADANA HALLI,23.95,,,,,
"PACHIN RIVER AT NAHARLAGUN (BELOW BARAPANI BRIDGE),",23.7,,,,,
"TUNGABHADRA AT D/S OF GANGAWATHI, KARNATAKA",23.63333333,,,,,
"KHARI AT LALI VILLAGE NEAR AHMEDABAD, GUJARAT",23.4,,,,,
"KRISHNA D/S OF SRISHAILAM, KURNOOL, A.P.",23.18333333,,,,,
"JHANJI AT N.H. CROSSING JORHAT, ASSAM",23.175,,,,,
"BHIMA AT FEROZABAD VILLAGE (D/S), KARNATAKA",23.16666667,,,,,
RIVER TUNGA AT D/S OF SHIMOGA TOWN,23.15,,,,,
"BURAI B/C TO TAPI MUKUDAS, DHULE",23.1,,,,,
KALINAD B/CI AT KANNAUJ,23,,,,,
"TUNGABHADRA AT NEW BRIDGE, KARNATAKA",22.81666667,,,,,
RIVER CAUVERY D/S OF MADDUR WATER SUPPLY TREATMENT PLANT AT BACHALLI,22.75,,,,,
"BHADRA AT U/S OF KIOCL, KARNATAKA",22.73333333,,,,,
RIVER SUTLEJ U/S CONFLUENCE WITH GANVI KHAND,22.5,,,,,
"RIVER CAUVERY AT SEERAPALAYAM, NAMAKAL,",22.45,,,,,
KELO RIVER U/S OF RAIGARH,22.31666667,,,,,
"CAUVERY AT MOHANUR NEAR PATTAIPALAYAM, TAMILNADU",22.3,,,,,
"TONS AT MADHAVGARH, NEAR PHED W/S INTAKE POINT, SA",22,,,,,
RIVER KABINI U/S INTAKE POINT TO NANJANAGUD and GUNDLUPET AT DEBUR,21.86666667,,,,,
NEUGAL D/S THURAL,21.6,,,,,
RIVER MAHI FOREST GUEST HOUSE RAJAPUR MATAJI SHIVGARH RATLAM.,21.575,,,,,
"RIVER RAPTI AFTER CONFL. OF R. HONIN NR. DOMINGARH RLY BRIDGE, GORAKHPUR",21.5,,,,,
KRISHNA D/S OF ALAMATTI DAM,21.5,,,,,
"GANGA AT HARIDWAR D/S, U.P",21.5,,,,,
DAMODAR NEAR MUJHER MANA VILLAGE A/C OF TAMLA NALLAH,21.5,,,,,
"RIVER NARMADA AT CHANDOD,",21.48333333,,,,,
"DAMODAR NEAR MUJHER MANA VILLAGE AFTER CONF. OF TAMLA NALLAH, WEST BENGAL",21.43333333,,,,,
"RAPTI A/C OF HONIN NR. DOMINGARH RLY BRIDGE, GORAKHPUR",21.3,,,,,
"MANAS RIVER AT NH-31 CROSSING, BARPETA, DISTRICT",21.175,,,,,
"BRAHAMPUTRA AT JOGIJHOGA NEAR BRIDGE, ASSAM",21.15,,,,,
"RIVER HINDON AT GHAZIABAD D/S KULESHRA GB NAGAR, U.P.",20.95,,,,,
"LIDDER NALLAH NERA BUMZOO, ANANTNAG",20.7,,,,,
"RIVER KABANI AT MUTHANKARA, WAYANAD",20.675,,,,,
"TUNGABHADRA AT HARIHAR WATER SUPPLY INTAKE, KARNATAKA",20.6,,,,,
"PANZARA NEAR PANZARAKAN SSK LTD, PANZARA, DHULE",20.5,,,,,
"DAMODAR,WATER INTAKE POINT FOR BURDWAN TOWN",20.5,,,,,
"BRAHMANI AT U/S PANPOSH, ODISHA",20.5,,,,,
D/S (SHUKLAGANJ),20.45,,,,,
"RIVER MANDAKINI AT CHITRAKUT, M.P.",20.225,,,,,
"CHAMBAL AT GANDHI SAGAR DAM, RAMPURA, MP",20.2,,,,,
"JAI BHARALI RIVER NEAR BISWANATH CHARALI, SONITPUR",20.15,,,,,
"GODAVARI RIVER AT D/S OF PAITHAN AT PATHEGAON BRIDGE, VILLAGE PATHEGAON, TALUKA PAITHAN, DISTRICT AURANGABAD.",20.1,,,,,
"BANAS AT BISULPUR DAM, TONK, RAJASTHAN",20.1,,,,,
"DISANG AT GUNDAMGHAT, ASSAM",20.09,,,,,
TAWI AT SHETALI LIFTING POINT NAGROTA,20,,,,,
RIVER UMTREW AT BYRNIHAT EAST,20,,,,,
"NANDAUR D/S SITARGANJ INDUSTRIAL AREA, US NAGAR",20,,,,,
GODAVARI AT RAJAHMUNDRY U/S,20,,,,,
"YAMUNA AT U/S DAK PATTHAR, UTTAR PARDESH",19.95,,,,,
SATLUJ 1 KM. D/S OF ZENITH,19.8,,,,,
GODAVARI RIVER NEAR TAPOVAN.,19.8,,,,,
ARKAVATHI AT D/S OF KANAKAPURA TOWN,19.725,,,,,
BHALLA RIVER AT LOHIA BRIDGE D/S KASHIPUR,19.66666667,,,,,
RIVER KHUGA (TUITHA) DAM ON KHUGA RIVER,19.625,,,,,
BHALLA RIVER U/S KASHIPUR,19.56666667,,,,,
"DWARKA , D/S OF TARAPITH, AT SATIGHAT",19.5,,,,,
"RIVER DAHA D/S AT SASAMUSA, GOPALGANJ",19.35,,,,,
"TUNGHABHADRA AT HONNALI BRIDGE, KARNATAKA",19.31666667,,,,,
"TUNGABHADRA AT JACKWELL POINT, KARNATAKA",19.31666667,,,,,
SANKH AT TIGRA RESERVOIR,19.3,,,,,
"RIVER RANGAVALI AT D/S OF NAVAPUR NEAR RANGAVALI BRIDGE, VILLAGE- NAVAPUR, TALUKA- NAVAPUR, DISTRICT- NANDURBAR.",19.2,,,,,
RIVER GHATAPRABHA AT W.A. POINT TO GOKAK TOWN,19.15,,,,,
"MAHI AT RANISINGH VILLAGE, RATLAM, UJJAIN",19.15,,,,,
"TUNGHABHADRA AT HARALAHALLI BRIDGE, KARNATAKA",19.13333333,,,,,
RIVER CAUVERY D/S OF KR NAGAR BRIDGE,19.11666667,,,,,
"RIVER UMKHRAH AT MAWPDANG, MAWLAI",19,,,,,
"MAHI AT VASAD, GUJARAT",19,,,,,
YAMUNA U/S OF LAKHWAR DAM,18.9,,,,,
"INDRAYANI RIVER AT U/S OF MOSHIGAON, HAWELI, PUNE.",18.9,,,,,
"RIVER MALAPRABHA AT WATER ABSTRACTION POINT TO HUBLI, DHARWAD",18.875,,,,,
"SONE AT OBRA, AURANGABAD",18.75,,,,,
"BRAHMPUTRA RIVER NEAR WATER INTAKE POINT AT KACHARIGHAT, PANBAZAR, GUWAHATI, ASSAM",18.725,,,,,
"BASANTER AT SAMBA (AT CHAK MANGA GUJJAR BASANTAR) D/S(R.H.S.), JandK",18.65,,,,,
GODAVARI AT RAJAMUNDRY U/S OF NALLA CHANNEL,18.61666667,,,,,
RIVER GODAVARI AT BASER(BANGALORE),18.525,,,,,
"GANGA AT BAHARAMPORE, MURSHIDABAD, WEST BENGAL",18.5,,,,,
"VASISTA AT SALEM, D/S OF SAGO INDUSRIES EFFLUENT, TAMILNADU",18.325,,,,,
DIKHOW RIVER AT DIKHOW BRIDGE,18.25,,,,,
"RIVER GIRI D/S CEMENT CORPORATION OF INDIA, RAJBAN AT BANGRAN BRIDGE",18.2,,,,,
"SHEONATH AT RAJNANDGAON, D/S AT MOHAD, RAJNANDGAON",18.19,,,,,
RIVER KRISHNA AT D/S OF DEVASAGAR BDG.,18.15,,,,,
"RIVER NIRA AT SANGAVI, VILLAGE- SANGAVI, TALUKA- PHALTAN, DISTRICT- SATARA.",18.05,,,,,
"DWARKA, U/S OF TARAPITH AT SADHAK BAMDEB GHAT",18,,,,,
RIVER NARMADA AT D/S OF VILL. JAIT,17.85,,,,,
"PAWANA RIVER AT SANGAVIGAON, VILLAGE SANGAVIGAON, TALUKA HAWELI, DISTRICT PUNE.",17.8,,,,,
RIVER KUNDA AT KHARGONE,17.7,,,,,
"BURHIDIHING NEAR DULIAJAN AT D/S, TINSUKIA, ASSAM",17.675,,,,,
RAVI AT CHAMERA RESERVOIR,17.575,,,,,
"CAUVERY AT KRS DAM, BALAMURIKSHETRA, KARNATAKA",17.4,,,,,
"GIRI RIVER D/S CEMENT CORPORATION OF INDIA, RAJBA",17.3,,,,,
"SATLUJ AT U/S HUSSANIWALA - H/W FEROZEPUR, PUNJAB",17.25,,,,,
"RIVER UNPUN NEAR PUNPUN ROAD BRIDGE, PUNPUN",17.225,,,,,
"YAMUNA AT KALANAUR, YAMUNA NAGAR, HARYANA",17.18333333,,,,,
"MUSI D/S AT PRATAPSINGARAM, HYDERABAD",16.95,,,,,
"SUSWA RIVER AT MOTHRAWALA, DEHRADUN",16.9125,,,,,
"BETWA AT NAYAPUR D/S MANDIDEEP INDL. AREA NO.1, DI",16.9,,,,,
"BHADRA AT D/S OF BHADRAVATHI,",16.8,,,,,
"INDRAVATI RIVER A/C DANTEWADA RIVER, NELSONNAR, DANTEWADA.",16.575,,,,,
"LIDDER NALLAH AT YANEER, D/S OF PHALGUM",16.57,,,,,
"U/S OF KATHAKAL AT MATIJURI, HAILAKANDI",16.5,,,,,
"GODAVARI RIVER AT NANDUR MADHMESHWAR DAM, VILLAGE NANDUR, TALUKA NIPHAD, DISTRICT NASHIK.",16.5,,,,,
"HARBORA RIVER AT NARKATIAGANJ, BIHAR",16.45,,,,,
"RIHAND AT RENUKUT D/S, U.P.",16.35,,,,,
"CAUVERY AT PALLIPPALAYAM, TAMIL NADU",16.31666667,,,,,
"RIVER KUNDU, NANDYAL, NEAR OVER BDG., KURNOOL, A.P",16.25,,,,,
BHADRA AT U/S OF MPM,16.25,,,,,
RIVER LUKHA AT KHADDUM,16.11666667,,,,,
RIVER LAKSHMANTIRTHA AT D/S OF KATTEMALAVADI,16.01666667,,,,,
SATLUJ U/S RAMPUR,16,,,,,
"PURNA AT DHUPESHWAR, MALKAPUR, AKOLA",16,,,,,
HASDEO AT U/S OF CHAMPA,16,,,,,
ARKAVATHI D/S OF KANAKAPURA TOWN,16,,,,,
NARMADA AT SETHANIGHAT M.P.,15.925,,,,,
"TUNGABHADRA AT U/S OF HPF, KARNATAKA",15.91666667,,,,,
"RIVER WAINGANGA AT CHHAPARA, NEAR ROAD BRIDGE AFTER MIXING MOTI and CHAMARIYA NALLA, JABALPUR",15.9,,,,,
"RIVER GODAVARI AT JALNA INTAKE WATER PUMP HOUSE, VILLAGE- SHAHABAD, TALUKA- AMBAD, DISTRICT- JALNA.",15.875,,,,,
"DIHING RIVER AT MIAO,",15.76666667,,,,,
GODAVARI AT RAJAMUNDRY D/S OF NALLA CHANNEL,15.7,,,,,
KUSEI BEFORE JOINING WITH BAITARANI RIVER AT ANANDPUR,15.6875,,,,,
"RIVER NARMADA, BARMANGHAT, 100 MDS OF MAINGHAT",15.65,,,,,
RIVER UMIAM MAWPHLANG AT MAWPHLANG,15.6,,,,,
SONE RIVER NEAR BANZARI,15.525,,,,,
UPPER GANGA D/S ROORKEE,15.5,,,,,
RIVER CAUVERY AT WATER SUPPLY INTAKE POINT TO MANDYA TOWN,15.46666667,,,,,
"BRAHMPUTRA RIVER AT SUALKUCHI, DIST. KAMRUP, ASSAM",15.41,,,,,
RIVER JHELUM AT PANTHACHOWK,15.35,,,,,
"RIVER CAUVERY AT SRI RANGAPATTANNA, D/S OF ROAD BDG.",15.25,,,,,
RIVER SUTLEJ D/S CONFLUENCES OF RIVER TIDONG,15.15,,,,,
"KALI EAST AT KHARKHODA PARIKSHIT GARH ROAD, VILL. KOL, MEERUT",15.15,,,,,
"WENA RIVER AT D/S OF MOHATA MILLS, NR RD BRG ON HINGANGHAT-WADNER ROAD",15.1,,,,,
YAMUNA AT HATHNIKUND HARYANA,15.03333333,,,,,
"BAGMATI RIVER AT DARBANGA, SAMASTIPUR ROAD BRIDGE,",15.01666667,,,,,
RIVER GIRI B/C WITH ASHWANI KHAD U/S OF WSS YASHWANT NAGAR,15,,,,,
MORNA RIVER D/S OF RAILWAY BRIDGE AKOLA,15,,,,,
"MANJEERA RIVER - NEAR GANAPATHI SUGARS , MEDAK DIST., A.P",15,,,,,
KABBANI D/S SARAGUR VILLAGE,15,,,,,
"GODAVARI RIVER AT RAMKUND, VILLAGE PANCHAVATI, TALUKA NASHIK, DISTRICT NASHIK.",15,,,,,
U/S HARBORA RIVER,14.9875,,,,,
SUBARNAREKHA AT MURI ROAD BRIDGE,14.98333333,,,,,
"TONS RIVER, H.P",14.9,,,,,
"KRISHNA RIVER AT KRISHNA VENNA SANGAM MAHULI , VILLAGE MAHULI,TALUKA MAHULI, DISTRICT SATARA.",14.75,,,,,
"BETWA AT SUKMA DUKMA DAM, JHANSI (U.P.)",14.725,,,,,
"KABBANI AT MUTHANKARA, KERALA",14.7,,,,,
"CAUVERY AT BANNUR BRIDGE,",14.65,,,,,
SONE RIVER AT NASIRIGANJ DAM,14.6,,,,,
HINDON D/S GHAZIABAD,14.6,,,,,
SUBARNAREKHA AT JAMSHEDPUR,14.57,,,,,
"RIVER KABINI AT BATHING GHAT, NANJANAGUD",14.56666667,,,,,
"MOR RIVER NEAR PADALASHE, VILLAGE PADALASHE,TALUKA JALGAON, DISTRICT JALGAON.",14.5,,,,,
RIVER KRISHNA AT TINTINI BRIDGE,14.45,,,,,
"RIVER GODAVARI AT D/S OF PAITHAN AT PATHEGAON BRIDGE, VILLAGE- PATHEGAON, TALUKA- PAITHAN, DISTRICT- AURANGABAD.",14.425,,,,,
"GODAVARI RIVER AT RAHER, VILLAGE RAHER, TALUKA NAYAGAON, DISTRICT NANDED.",14.35,,,,,
"RUPNARAYAN BEFORE CONFL. TO RIVER GANGA NEAR GEONKHALI,MEDINIPORE",14.25,,,,,
"DHOUS AT MADHUVAPUR, MADHUBANI",14.225,,,,,
"RIVER KALI SINDH AT ANICUT OF M/S CFCL GADEPAN, KOTA, RAJASTHAN",14.21666667,,,,,
"TUNGABHADRA AT KURNOOL U/s, BAVAPURAM",14.2,,,,,
"RIVER BHAWA KHAD AT RESERVIOR SITE OF ALLIAN DUHANGAN HEP,PRINI,MANALI",14.2,,,,,
"CAUVERY AT PETTAIVAITHALAI, TRICHY, TAMILNADU",14.2,,,,,
RAVI AT AT D/S CHAMERA III HEP,14.05,,,,,
RIVER CAUVERY AT WATER SUPPLY INTAKE POINT AT KOLLEGALA DASANAPURA,14,,,,,
"GANDAK AT KONHARA GHAT, VAISHALI",13.975,,,,,
RIVER BEAS AT PANDOH DAM,13.95,,,,,
"BANGANGA (IN FRONT OF PONY SHED NEAR REASI BRIDGE)KATRA,JandK",13.95,,,,,
"YAMUNA AT U/S DAK PATHER, UTTARAKHAND",13.9,,,,,
"DHANSIRI AT NUTON BASTI, NAGALAND",13.75,,,,,
"RIVER SABARMATI AT HANSAOL BRIDGE, GUJARAT",13.7,,,,,
"CAUVERY AT URACHIKOTTAI, ERODE",13.7,,,,,
"BAGHWATI NAGAR (2KM D/S TAWI BRIDGE), JandK",13.7,,,,,
SUBARNAREKHA AT HATIA DAM,13.66666667,,,,,
"R.SONE AT ORIGINE AMARKANTAK, M.P",13.65,,,,,
"RIVER SERLUI D/S, SERLUI 'B' HEPP DAM, BILKHAWTHLIR, KOLASIB DIST.",13.575,,,,,
RIVER ANDHRA B/C TO RIVER PABBAR AT CHIRGAON,13.5,,,,,
"KRISHNA RIVER AT KSHETRA MAHULI, VILLAGE KSHETRA MAHULI,TALUKA MAHULI, DISTRICT SATARA.",13.5,,,,,
"GODAVARI RIVER AT KAPILA GODAVARI CONFLUENCE POINT, VILLAGE TAPOVAN, TALUKA NASHIK, DISTRICT NASHIK.",13.5,,,,,
BEKI RIVER AT NH-37 CROSSING AT BARPETA ROAD,13.48333333,,,,,
RIVER CAUVERY AT SATHYAGALAM BRIDGE,13.4,,,,,
RIVER GARGA NEAR TELMUCHO BRIDGE,13.36666667,,,,,
"YAMUNA AT WAZIRABAD, DELHI",13.3,,,,,
"BHIMA RIVER AT TAKLI NEAR KARNATAKA BORDER, VILLAGE TAKALI, TALUKA SOUTH SOLAPUR, DISTRICT SOLAPUR.",13.3,,,,,
RIVER KRISHNA - ANKALI BRIDGE ALONG CHIKKODI KAGWAD ROAD,13.28333333,,,,,
RIVER MALAPRABHA AT D/S OF AIHOLE TOWN,13.25,,,,,
"DHANSIRI AT FULL NAGARJAN, NAGALAND",13.25,,,,,
BEAS AT U/S PANDON DAM,13.25,,,,,
U/S MANUSMAR RIVER (RIGA),13.2375,,,,,
"GHOD RIVER AT SHIRUR, VILLAGE SHIRUR,TALUKA SHIRUR,DISTRICT PUNE.",13.2,,,,,
RAVI AT MADHOPUR (PUNJAB),13.15,,,,,
"JAMUNI AT BARIYAGHAT U/S NEAR INTAKE POINT, TIKAMG",13,,,,,
"CHAMBAL AT KOTA D/S (2 KM. FROM CITY),RAJASTHAN",13,,,,,
CAUVERY AT NAPOKULU BDG (D/S),12.95,,,,,
"RIVER BANGANGA (BATHING GHAT), KATRA,",12.9,,,,,
"WARDHA RIVER AT U/S OF ERAI RIVER, HADASTI, CHANDRAPUR.",12.85,,,,,
"BRAHMPUTRA RIVER AT DHENUKHAPAHAR, ASSAM",12.84,,,,,
"CHUNT KOL (MAULANA AZAD BRIDGE), JandK",12.8,,,,,
KOLONG RIVER AT MARIGAON,12.78333333,,,,,
"CAUVERY AT PETTAIVAITHALAI, TRICHY",12.775,,,,,
"GODAVARI RIVER AT JALNA INTAKE WATER PUMP HOUSE, VILLAGE SHAHABAD, TALUKA AMBAD, DISTRICT JALNA.",12.75,,,,,
"RIVER RIVER WAINGANGA AT CHHAPARA , SEONI, NEAR WSS INTAKE POINT",12.7,,,,,
CHAMBAL D/S NAGDA,12.7,,,,,
"GODAVARI AT RAMAGUNDAM U/S , KARIMNAGAR",12.6,,,,,
"RIVER TAPI AT RANDER BRIDGE, SURATRANDER,SURAT",12.5,,,,,
"RIVER KIM AT SAHOL BRIDGE, OLPAD HANSOT ROAD, DIST",12.5,,,,,
"RIVER KANOTA DAM VILLAGE SUMEL, TEHSIL- BASSI",12.5,,,,,
WATER SUPPLY INTAKE POINT TO SRIRANGAPATNA TOWN,12.4,,,,,
"RIVER TITUR AT D/S OF CHALISGAON, VILLAGE. CHALISGAON,TALUKA. JALGAON,DISTRICT. JALGAON.",12.4,,,,,
"KAPILI RIVER AT DHARMTUL BRIDGE, NH31, NAGAON, ASSAM",12.4,,,,,
"CHADRA GAON VIEW POINT(4 KM U/S FROM SPOT), JandK",12.4,,,,,
ASHWANI RIVER AT SADHUPUL (U/S OF BRIDGE TOWARDS CHAIL.),12.4,,,,,
"THIRUMANIMUTHAR AT SALEM, D/S OF SAGO and TEXTILE DYING INDUSTRIES, TAMILNADU",12.3625,,,,,
RIVER BEAS AT U/S KULLU,12.35,,,,,
"PANCHAGANGA RIVER AT D/S OF KOLHAPUR TOWN AT GANDHI NAGAR NEAR NH4 BRIDGE AND MIDC, VILLAGE UCHEGAON, TALUKA KOLHAPUR, DISTRICT KOLHAPUR.",12.3,,,,,
"GODAVARI RIVER AT LATUR WATER INTAKE NEAR PUMP HOUSE. VILLAGE DHAMEGAON, TALUKA KALUMB, DISTRICT OSMANABAD.",12.3,,,,,
"BRAHAMPUTRA AT DIBRUGARH, ASSAM",12.275,,,,,
"RIVER SIKRAHNA LAURIA-NARKATIAGANJ ROAD BRIDGE, WEST CHAMPARAN",12.26666667,,,,,
RAMGANGA B/C AT KANNAUJ,12.25,,,,,
"SEONATH AT SHIMGA AFTER CONFL. WITH R. KHAROON,CHHATISSGARH",12.2,,,,,
RIVER KHARSANG BEFORE CONFLUENCE WITH BURIDIHING N,12.2,,,,,
"RIVER HUNDRI, JOHARPUR(V), NEAR TEMPLE, KURNOOL, A",12.2,,,,,
MAHANADI AT MUNDALI (WATER INTAKE POINT OF BHUBANESWAR CITY),12.175,,,,,
"SAMBA (BELOW NH1A BRIDGE), BASANTAR US (R.H.S)",12.15,,,,,
TALCHER FD/S,12.125,,,,,
"TUNGABHADRA AT D/S OF GANGAWATHI,",12.1,,,,,
