Year,AVERAGE of BOD_Avg,AVERAGE of DO_Avg,,,,
"HASDEO 100 METER D/S A/C OF DENGUR NALLAH NERA C.S.E.B. EAST GUEST HOUSE, KORBA",4.5,,,,,
GANDAK ATSAMASTIPUR RD BDG,4.5,,,,,
CAUVERY AT PALLIPALAYAM,4.5,,,,,
"BRAHMPUTRA RIVER AT DHENUKHAPAHAR,",4.5,,,,,
"BRAHAMPUTRA AT KHERGHAT (AFTER CONFL. WITH DIBANG and DIHANG), ASSAM",4.5,,,,,
"GOHAD DAM, GOHAD, M.P",4.49,,,,,
YAMUNA AT HAMIRPUR,4.4875,,,,,
GANGA DARBHANGA GHAT AT PATNA,4.4875,,,,,
"KARO AT LOHOJIMI U/S, JHARKAND",4.483333333,,,,,
"TUNGABHADRA AT NEW BRIDGE,",4.475,,,,,
RIVER RANGPO AT D/S OF PHARMA PLANT KUMREK,4.475,,,,,
BATHER KHAD WATER SUPPLY SCHEME AT DAL LAKE,4.475,,,,,
MAHI AT SEVALIA,4.46,,,,,
"RIVER GODAVARI AT JALNA INTAKE WATER PUMP HOUSE, SHAHABAD, AMBAD, JALNA",4.45,,,,,
"NARMADA AT BHARUCH, ZADESHVAR",4.45,,,,,
"MAHANADI AT PARADEEPD/S, ORISSA",4.45,,,,,
"BRAHMPUTRA NEAR WATER INTAKE POINT AT KACHARIGHAT, PANBAZAR, GUWAHATI",4.45,,,,,
DZU D/S KOHIMA TOWN,4.440625,,,,,
GANGA AT GARHMUKTESHWAR,4.44,,,,,
"NARMADA AT AMARKANTAKE FROM ORIGIN POINT, REWA",4.4375,,,,,
"LAKSHMANTIRTHA AT D/S OF KATTEMALAVADI, KARNATAKA",4.433333333,,,,,
CAUVERY AT WATER SUPPLY INTAKE POINT TO MANDYA TOWN,4.433333333,,,,,
"MAHANADI AFTER CONFL. WITH RIVER MAND,CHHATISSGARH",4.43,,,,,
GANGA AT NARORA (BULANDSAHAR),4.43,,,,,
"CHURNI D/S OF SANTIPUR TOWN, WEST BENGAL",4.425,,,,,
"WAINGANGA U/S OF GAURAV PAPER MILLS, NEAR JACKWELL, BRAMHPURI, CHANDRAPUR",4.4,,,,,
U/S OF KR NAGAR,4.4,,,,,
TAWI AT SURAJPUR CHATHA(10 KM D/S TAWI BRIDGE)BELOW BRIDGE NEAR CHATHA MSW DUMPING SITE,4.4,,,,,
"SUKHANA RIVER AT PARWANOO, DISTT. SOLAN",4.4,,,,,
RIVER SUTLEJ U/S CONFLUENCE WITH GANVI KHAND HIMACHAL PRADESH,4.4,,,,,
"RIVER BHIMA AT PUNE, D/S OF BUNDGARDEN, YERWADA, HAWELI, PUNE",4.4,,,,,
"RIVER BHIMA AT KOREGAON NEAR KOREGAON BRIDGE, SHIRUR, PUNE",4.4,,,,,
"POONPUN RIVER NEAR POONPUN RAIL BRIDGE, PATNA",4.4,,,,,
"MULA RIVER AT HARRISON BRIDGE NEAR MULA PAWANA SANGAM, BOPODI, HAWELI,",4.4,,,,,
"INDRAYANI RIVER AT D/S OF ALANDIGAON, VILLAGE ALANDIGAON, TALUKA HAWELI, DISTRICT PUNE.",4.4,,,,,
GHAGHARA AT DEORIA D/S,4.4,,,,,
"DAMODAR NEAR MUJHER MANA VILLAGE AFTER CONF. OF TAmLA NALLAH, BURDWAN,WEST BENGAL",4.4,,,,,
"BIRUPA AT CHOUDWAR, ORISSA",4.4,,,,,
"BETWA BEFORE CONF. YAMUNA AT HAMIRPUR,",4.4,,,,,
"BERENG RIVER AT CHOWKHAM,",4.4,,,,,
"AMARAVATI , GUNTUR DIST., A.P",4.4,,,,,
RIVER GOMTI AT NEEMSAR U/S,4.39,,,,,
"YAMUNA AT VISHRAMGHAT, MATHURA",4.375,,,,,
"KUSEI BEFORE JOINING WITH BAITARANI RIVER AT ANANDPUR, DEOGAON",4.375,,,,,
RIVER TIRTHAN B/C TO RIVER SUTLEJ,4.366666667,,,,,
MANJEERA AT GOWDICHARLA A/C WITH NAKKAVAGU,4.36,,,,,
"YAMUNA AT YAMUNOTRI, UTTAR PRADESH",4.35,,,,,
"TAPI AT UBAD VILLAGE,SHAHADA, NANDURBAR",4.35,,,,,
"SUTLEJ AT 100M D/S , NANGAL",4.35,,,,,
SIUEL AT D/S SURGANI,4.35,,,,,
RIVER TAWI BAGHWATI NAGAR (2KM D/S TAWI BRIDGE,4.35,,,,,
"RIVER PUNPUN AT KINJAR ROAD BRIDGE, JEHANABAD-ARWAL BORDER , JEHANABAD",4.35,,,,,
RIVER MAHI AT MUJPUR,4.35,,,,,
HINDON AT GHAZIABAD D/S,4.35,,,,,
D/S OF ASHWANI KHAD (AFTER CONFLUENCE OF LIFT NALLAH),4.35,,,,,
BANGANGA (IN FRONT OF PONY SHED NEAR REASI BRIDGE)KATRA,4.35,,,,,
BRAHMANI AT TALCHER U/s,4.3375,,,,,
"WAINGANGA AT CHHAPARA, NEAR ROAD BRIDGE AFTER MIXI",4.325,,,,,
KOEL U/S (AFTER CONFLUENCE OF RIVER KARO),4.3125,,,,,
"WAINGANGA D/S OF GAURAV PAPER MILLS, NEAR JACKWELL, BRAMHPURI, CHANDRAPUR",4.3,,,,,
RIVER UMIAM MAWPHLANG AT SHELLA,4.3,,,,,
RIVER TAPTI AT NEPA NAGAR 100 METRE D/S AFTER MIXI,4.3,,,,,
RIVER SUTLEJ D/S KHAIRIAN SOLID WASTE DUMPING SITE BILASPUR,4.3,,,,,
"RIVER RAMGANGA AT KALAGARHBARRAGE,KALAGARH,DIST,PAUDHIGADHWAL (U.K.)",4.3,,,,,
"RIVER MAHANADI AT INTERSTATE BOUNDRY, CHHATISGARH.",4.3,,,,,
"RIVER KIM AT SAHOL BRIDGE, OLPAD HASOT ROAD, DIST SURAT",4.3,,,,,
"RIVER HIRAN, NH -12 ROAD BRIDGE VIL VIKRAMPUR ,DIST NARSINGPUR",4.3,,,,,
"KRISHNA AT GAWALI GALLY,MIRAJ,SANGLI",4.3,,,,,
"KOLAR BEFORE CONFLUENCE TO KANHAN AT WAREGAON, KAMPTEE, NAGPUR",4.3,,,,,
"KOHORA RIVER AT N.H. CROSSING, KOHORA, ASSAM",4.3,,,,,
KHAGRA,4.3,,,,,
"KALJANI D/S OF ALIPURDWAR, MUNICIPALITY DISCHARGE POINT",4.3,,,,,
"KAGINA AT SHAHABAD BRIDGE,",4.3,,,,,
"KABINI AT BATHING GHAT, NANJANAGUD",4.3,,,,,
"KABBANI AT WATER INTAKE OF KIADB AT NANJANGUD, KAR",4.3,,,,,
GODAVARI RIVER AT LATUR WATER INTAKE NEAR PUMP HOUSE AT DHAMEGAON.,4.3,,,,,
GHATPRABHA AT W.A. POINT TO GOKAK TOWN,4.3,,,,,
D/S SHIMSHA NEAR MADDUAR TOWN,4.3,,,,,
"BRAHMANI AT DHARMASHALA, ORISSA",4.3,,,,,
"RIVER GANGA AT DIAMOND HARBOUR, 24 PARGANAS (S)WEST BENGAL",4.283333333,,,,,
"BEAS D/S NADAUN BRIDGE, VILL BHADOLI",4.283333333,,,,,
RIVER IB AT BRAJARAJNAGAR (INTAKE) D/S,4.266666667,,,,,
"RIVER VARUNA AT RAMESHWAR, VARANASI",4.264285714,,,,,
RANGA NADI D/S OF HYDEL PROJECT,4.2625,,,,,
MAHANADI AT SAMBALPUR U/S,4.2625,,,,,
VISHWAMITRI DOWNSTREAM AT KHALIPUR VILLAG,4.25,,,,,
"SABARI AT KUNAVARAM, KHAMMAM, A.P",4.25,,,,,
"RIVER SENKI AT CHANDRANAGAR, ITANAGAR, (U/S OF PACHIN RIVER)",4.25,,,,,
"RIVER KIM AT SAHOL BRIDGE, OLPAD HANSOT ROAD, DIST. SURATSAHOL, OLPAD HANSOT ROAD, SAHOL BRIDGE,SURAT",4.25,,,,,
RIVER GOMTI AT MOHMEAK U/S,4.25,,,,,
"RIVER CAUVERY AT PETTAIVAITHALAI, TRICHY, TAMILNADU",4.25,,,,,
NARMADA AT MANDLESHWAR M.P.,4.25,,,,,
"KSHIPRA AT RAMGHAT AT UJJAIN, M.P.",4.25,,,,,
"IB AT BRAJRAJNAGAR (INTAKE) D/S, ODISHA",4.25,,,,,
"GODAVARI RIVER AT JALNA INTAKE WATER PUMP HOUSE, SHAHABAD.",4.25,,,,,
GANGA AT U/S BHAGALPUR,4.25,,,,,
"GANGA AT PATNA D/S (GANGA BRIDGE), BIHAR",4.25,,,,,
"DZUDZA RU IN KOHIMA, NAGALAND",4.25,,,,,
DHANSIRI RIVER AT JAHAIGHAT,4.25,,,,,
"CAUVERY AT KRS DAM,BALAMURIKSHETRA,KARNATAKA",4.25,,,,,
"BRAHMANI AT D/S PANPOSH, ORISSA",4.25,,,,,
"BHAVANI AT ELACHIVAZHY, KERALA",4.25,,,,,
"BANAS AT BISULPUR DAM, TONK",4.25,,,,,
KUAKHAI AT BHUBANESWAR U/s,4.2375,,,,,
"RIVER SABARMATI AT KHEROJ BRIDGE,",4.233333333,,,,,
"SUTLEJ AT 100 MT. D/S OF PACL, NANGAL, PUNJAB",4.225,,,,,
RIVER NARMADA AT MANDLESHWAR,4.216666667,,,,,
SANGI DALAN,4.2,,,,,
"RIVER YAMUNA AT U/S DAK PATHER,",4.2,,,,,
"RIVER TUIPUI U/S, NR CONFLUENCE PT KEILUNGLIAH STREAM, VENGTHAR, CHAMPHAI",4.2,,,,,
RIVER RUSHIKULYA AT ASKA,4.2,,,,,
"RIVER RANGIT AT MANPUR(BELOW INDUSTRIAL AREA),NAMCHI DIST SIKKIM",4.2,,,,,
"RIVER KALI EAST AT KHARKHODAPARIKSHIT GARH ROAD, VILL. KOL, MEERUT",4.2,,,,,
"RIVER GODAVARI AT RAMAGUNDAM U/S , KARIMNAGAR",4.2,,,,,
"RIVER GHOD AT SHIRUR, PUNE",4.2,,,,,
"RIVER BICHIA, BRIDGE GOVINDGARH ROAD",4.2,,,,,
NARMADA AT D/S OF TEXTILE UNIT VILLAGE. HOLIPURA BUDNI,4.2,,,,,
KAMALA RIVER AT BENIPATTI (MADHUBANI),4.2,,,,,
"JAI BHARALI NR BISWANATH CHARALI, SONITPUR",4.2,,,,,
GANGA RIVER NEAR DANAPUR (NEAR PIPAPUL),4.2,,,,,
"GANGA AT BAHARAMPORE, MURSHIDABAD,",4.2,,,,,
CHANDRABHAGA U/S OF PANDHARPUR TOWN,4.2,,,,,
BURHIDIHING AT DULIAJAN (INTAKE POINT OF OIL INDIA LTD.),4.2,,,,,
"BEKI RIVER AT NH37 CROSSING AT BARPETA ROAD, ASSAM",4.2,,,,,
BAITARNI AT JODA ORISSA,4.2,,,,,
"WAINGANGA D/S OF GAURAV PAPER MILLS, NEAR JACKWELL.",4.185,,,,,
YAMUNA AT ETAWAH,4.183333333,,,,,
"RIVER SONE AT CHURHAT,DISTT.SIDHI",4.183333333,,,,,
"KUNDLI RIVER AT KUNDLI/ SAPAKHOWA, SADIA.",4.183333333,,,,,
"CAUVERY AT RANGANATHITTU, KARNATAKA",4.183333333,,,,,
"SATLUJ AT D/S RAMPUR, H.P.",4.175,,,,,
GANGUA AT VADIMULA,4.175,,,,,
D/S OF CAUVERY AT BHAGAMANDALA BRIDGE,4.175,,,,,
"RIVER GANGA AT GARDEN REACH, KOLKATA, WEST BENGAL",4.166666667,,,,,
"PENNAR AT SIDDVATA, NELLORE, A.P.",4.166666667,,,,,
BEAS AT 100M D/S INDUST. DISCH. GOINDWAL PUNJAB,4.166666667,,,,,
"INDRAYANI RIVER AT D/S OF ALANDIGAON, PUNE",4.1625,,,,,
"RIVER UMNGOT AT SMIT,",4.15,,,,,
"KRISHNA AT THANGADI , MAHABOOBNAGAR DIST.",4.15,,,,,
"KOLAK AT PATALIA BDG., GUJARAT",4.15,,,,,
GANGA AT U/S SULATANGANJ,4.15,,,,,
"DZUCHA RU IN KOHIMA, NAGALAND",4.15,,,,,
"DIKHOW RIVER AT NAGINI MORA (INTER-STATE BOUNDARIES, ASSAM- NAGALAND)",4.15,,,,,
"DARNA RIVER AT CHEHEDI WATER WORKS (PUMPING STATION), VILLAGE CHEHEDI, TALUKA NASHIK, DISTRICT NASHIK.",4.15,,,,,
D/S OF VINDYADHARI RIVER AT MALANCHA BURNING GHAT,4.15,,,,,
BHADRA AT D/S OF BHADRAVATHI,4.15,,,,,
"BETWA U/S, BEENA",4.15,,,,,
GANGA AT PALTA,4.1375,,,,,
RIVER VARUNA B/C WITH RIVER GANGA AT VARANASI,4.133333333,,,,,
"SHEDHI AT KHEDA, GUJARAT",4.125,,,,,
RIVER HINDON AT MAHESHPUR U/S,4.125,,,,,
"PARVATI BEFORE MEETING RIVER CHAMBAL AT KHATOLI, KOTA, RAJASTHAN",4.125,,,,,
CAUVERY AT MOHANUR NEAR PATTAIPALAYAM,4.125,,,,,
"KELO RIVER D/S OF RAIGARH, CHHATISGARH.",4.1125,,,,,
DAMODAR AT PANCHET DAM,4.1125,,,,,
YAMUNA AT DAK PATHER (UTTARAKHAND),4.1,,,,,
"WENA RIVER AT D/S OF MOHATA MILLS, NR RD BRG ON HINGANGHATWADNER ROAD, HINGANGHAT, WARDHA",4.1,,,,,
"TAPI AT AJAND VILLAGE, RAVER, JALGAON",4.1,,,,,
"RIVER UMKHEN AT WAH KDAIT,",4.1,,,,,
RIVER THONGJAOROK AT THONGJAOROK BRIDGE,4.1,,,,,
RIVER SIUEL AT D/S SURGANI,4.1,,,,,
"RIVER CHOUPAN AT VIJAYPUR U/S NFL NALLA, GUNA",4.1,,,,,
NARMADA AT D S OF OMKARESHWAR M.P.,4.1,,,,,
NARMADA AT CHANDOD,4.1,,,,,
"NABADIP ON GANGA, GHOSHPARA NEAR MONIPURGHAT,NADIA",4.1,,,,,
"MANDAKINI AT CHITRAKUT, M.P.",4.1,,,,,
"MANAS AT NH31 CROSSING, BARPETA, DISTRICT",4.1,,,,,
"KANHAN D/S OF NAGPUR, AGARGAON, KUHI, NAGPUR",4.1,,,,,
"GODAVARI RIVER NEAR SOMESHWAR TEMPLE, SOMESHWAR, NASHIK",4.1,,,,,
"GANGA AT ULUBERIA , HOWRAH,WEST BENGAL",4.1,,,,,
GANGA AT PATIKALI NEAR DURGA CHAK WEST BENGAL,4.1,,,,,
GANGA AT HOWRAHSHIVPUR WEST BENGAL,4.1,,,,,
"DARNA RIVER AT SANSARI, VILLAGE SANSARI,TALUKA NASHIK,DISTRICT NASHIK.",4.1,,,,,
"CHENAB AT L.H.S.(BELOW BRIDGE CHENAB),JandK",4.1,,,,,
"CAUVERY AT SATHYAGALAM BRIDGE, KARNATAKA",4.1,,,,,
"BOGINADI NEAR BRIDGE NH52, LAKHIMPUR, ASSAM",4.1,,,,,
"YAMUNA AT MATHURA U/S , U.P.",4.09,,,,,
MAHANADI AT TIKARPADA,4.09,,,,,
"RIVER GANGA AT BEHRAMPORE, (GORA BAZAR),MURSHIDABAD",4.0875,,,,,
"KHAROON RIVER BUNDRI, RAIPUR, CHHATISGARH.",4.0875,,,,,
"RIVER DAHA U/S SASAMUSA, GOPALGANJ",4.083333333,,,,,
RIVER CAUVERY AT ERODE U/S,4.083333333,,,,,
"KSHIPRA AT SIDDHAWAT (D/S) OF UJJAIN., M.P.",4.083333333,,,,,
"RIVER GANGA AT PALTA, SHITALTALA,",4.08,,,,,
MAHANANDA AT SILIGURI,4.08,,,,,
"KANHAN AT CHINDWARA BEFORE MIXING BOREGAON GROWTH CENTRE NALLA, JABALPUR",4.08,,,,,
RIVER MAHANADI AT KHAROD,4.075,,,,,
"NIRA AT SAROLE BDG.ON PUNE-BANGLORE HIGHWAY, MAHARASHTRA",4.075,,,,,
BHAVANI AT ELACHIVAZHY,4.075,,,,,
RIVER TUNGABHADRA AT MYLARA,4.066666667,,,,,
"MAHANADI AT KHARAD, CHHATISGARH.",4.0625,,,,,
"SUTLEJ RIVER B/C WITH RIVER SPITI AT KHAB, DISTT. KINNAUR",4.05,,,,,
"SABARMATI AT RAILWAY BRIDGE, AHMEDABAD",4.05,,,,,
"RIVER SAIKAH STREAM, LAWNGTLAI",4.05,,,,,
RIVER MARKANDA AFTER CONFLUENCE WITH SALANI KHAD AT MOGINAND KALA AMB,4.05,,,,,
"RIVER DZUNA RU IN KOHIMA, ADJOINING THE NEW KOHIMA MUNICIPAL COUNCIL SOLID WASTE MANAGEMENT SITE, NAGALAND",4.05,,,,,
"KRISHNA AT KRISHNA BRIDGE, KARAD, MAHARASHTRA",4.05,,,,,
"KIM RIVER AT SAHOL BRIDGE, OLPAD HANSOT ROAD, DIST. SURAT",4.05,,,,,
"GABHARU RIVER NEAR BRIDGE AT NH52, NEAR TUMIUKI, SONITPUR",4.05,,,,,
DAYA AT BHUBANESWAR FD/S ( 2 KM A/C OF GANGUA NALLAH WITH RIVER DAYA),4.05,,,,,
DAMODAR AT NARAINPUR AFTER CONFL. OF NUNIA NALLAH,4.05,,,,,
"BHIMA AT NARSINGPUR, (D/S AF.CONFL.WITH R.NIRA), NARSINGPUR, MALSHIROS",4.05,,,,,
BAITARNI AT JAJPUR ORISSA,4.05,,,,,
"JHELUM RIVER AT SANGAM, CONFLUENCE POINT OF VISHAV NALLAH",4.025,,,,,
"SONE AT AMLAI, M.P.",4.016666667,,,,,
"SHIMSHA AT D/S OF BRIDGE, HALAGUR, KARNATAKA",4.016666667,,,,,
RIVER RANGIT AT LEGSHIP,4.016666667,,,,,
RIVER CAUVERY D/S AT BHAGAMANDALA BRIDGE,4.016666667,,,,,
SUBARNAREKHA AT CHANDIL BRIDGE,4.01,,,,,
"YAMUNA A/C OF CHAMBAL AT SHERGARH, JUHIKA (U.P)",4,,,,,
WATER SUPPLY INTAKE POINT TO MADIKERI TOWN,4,,,,,
"WARDHA RIVER D/S OF ACC GHUGGUS, CHANDRAPUR, CHANDRAPUR",4,,,,,
"WAINGANGA AT CHHAPARA, NEAR W/S INTAKE POINT, JABA",4,,,,,
"U/S HARBORA RIVER, BIHAR",4,,,,,
"TAPI AT KATHORE, (NH8 BRIDGE), GUJARAT",4,,,,,
"SUTLEJ AT BRIDGE HARIKE, AMRITSAR",4,,,,,
"SONE AT CHITAWAL NEAR ROAD BRIDGE CHITRANGI, DIST SINGROULI",4,,,,,
"SIRISWAA AT RUXOL,",4,,,,,
SABARMATI AFTER CONF. WITH MESHWA AT VAUTHA (NEAR,4,,,,,
"RIVER SWAN AT D/S NANGAL DISTT. UNA, H.P.",4,,,,,
"RIVER SUTLEJ AT 100M D/S , NANGAL",4,,,,,
RIVER NARMADA U/S BEFOR CONFLUENCE TAWA NEAR BANDRABHAN,4,,,,,
"RIVER HINDON AT GHAZIABAD D/S, U.P.",4,,,,,
RIVER GANGA AT D/S SARIKPUR,4,,,,,
RIVER ALAKNANDA B/C TO BHAGIRATHI AT DEVPRAYAG,4,,,,,
"NARMADA AT BADWANI,",4,,,,,
"MANUSMAR RIVER AT RIGA, SITAMARHI, BIHAR",4,,,,,
"KRISHNA RIVER AT KRISHNA- VENNA SANGAM AT MAHULI, SATARA",4,,,,,
"KRISHNA AT D/S OF NARAYANPURA DAM, KARNATAKA",4,,,,,
"KOSHI RIVER AT MADHEPURA, BIHAR",4,,,,,
KAGINA AT SHAHABAD,4,,,,,
"KACHCHIDARGAH BIDUPUR ROAD BRIDGE, PATNA",4,,,,,
"INDRAYANI RIVER AT D/S OF MOSHI VILLAGE. VILLAGE MOSHI, TALUKA HAWELI, DISTRICT PUNE.",4,,,,,
HARABAGH(INTAKE FROM BBMB SOURCE-BBMB ADIT HARABGH) WATER SPRING,4,,,,,
"GODAVARI RIVER AT TAPOVAN, TAPOVAN, NASHIK",4,,,,,
GANGA AT THE CONFLUENCE OF SONE RIVER DORIGANJ,4,,,,,
DZUNA RU (CONFLUENCE OF DZUCHA and DZUNA RU) IN KOHIMA,4,,,,,
"DARNA RIVER AT MES SITE PUMPING STATION, VILLAGE BHAGUR, TALUKA NASHIK, DISTRICT NASHIK.",4,,,,,
"D/S DAHA RIVER AT SASAMUSA, BIHAR",4,,,,,
"CAUVERY AT SRI RANGAPATTANNA, D/S OF ROAD BDG., KA",4,,,,,
"BETWA AT KANJIA ROAD BRIDGE, ASHOK NAGAR (M.P.)",4,,,,,
BASANTER AT SAMBA (AT CHAK MANGA GUJJAR BASANTAR) D/S(R.H.S.),4,,,,,
"ASANGI NALLA AT ASANGI VILLAGE, KARNATAKA",4,,,,,
WARDHA RIVER D/S OF ACC GHUGGUS.,3.983333333,,,,,
"RIVER HARBORA,U/S AT NARKATIAGANJ, WEST CHAMPARAN",3.975,,,,,
KRISHNA D/S OF ISLAMPUR,3.975,,,,,
BHAVANI AT BHAVANI,3.975,,,,,
RIVER BEAS AT D/S PONG DAM,3.966666667,,,,,
"NIRA RIVER AT U/S OF JUBILANT ORGANOSIS, BARAMATI, PUNE.",3.966666667,,,,,
RIVER TORSA D/S OF GHUGHUMARI,3.96,,,,,
GANGA AT D/S BUXAR NEAR GANGA BRIDGE,3.96,,,,,
"WENA RIVER AT D/S OF MOHATA MILLS, NR RD BRG ON HINGANGHAT-WADNER ROAD, HINGANGHAT, WARDHA",3.95,,,,,
"VENNA RIVER AT MAHABALESHWAR, SATARA",3.95,,,,,
SATLUJ AT NEPTHA ZAKHAI,3.95,,,,,
"SABARMATI AT VILL. MIROLI TALUKA DASCROI,",3.95,,,,,
RIVER NARMADA AT SETHANIGHAT,3.95,,,,,
RIVER GANGA CHUSA AT BUXAR,3.95,,,,,
"RAVI AT U/S OF MADHOPUR HEADWORKS, GURDASPUR",3.95,,,,,
"NARMADA AT LALPUR, NEAR WATER SUPPLY INTAKE POINT, JABALPUR",3.95,,,,,
HASDEO AT U/S KORBA,3.95,,,,,
"DAMODAR AT NARAINPUR AFTER CONFL. OF NUNIA NALLAH, BURDWAN,WEST BENGAL",3.95,,,,,
BEAS AT D/S PATHANKOT,3.95,,,,,
SUKETI KHAD D/S SWM SITE AT SUNDER NAGAR,3.925,,,,,
"PAWNA RIVER AT KASARWADI, HAWELI, PUNE.",3.925,,,,,
"NARMADA AT LALPUR, NEAR WATER SUPPLY INTAKE POINT,",3.925,,,,,
"RIVER KALI SINDH AT BAROD ROAD BRIDGE, KOTA, RAJASTHAN",3.916666667,,,,,
MAHANADI POWER CHANNEL U/S,3.916666667,,,,,
GODAVARI RIVER AT SAIKHEDA.,3.9125,,,,,
"YAMUNA AT JUHIKA BC WITH CHAMBAL, ETAWAH, U.P",3.9,,,,,
"YAMUNA , D/S PAONTA SAHIB, H.P",3.9,,,,,
"THANGADI , MAHABOOBNAGAR DIST.",3.9,,,,,
"SINA RIVER NEAR LABOTI TOLL NAKA, VILLAGE LABOTI,TALUKA MOHAL, DISTRICT SOLAPUR.",3.9,,,,,
"SABARMATI AT GANDHI NAGAR CHILODA BRIDGE, LEKAWADA",3.9,,,,,
"RIVER, TLAWNG SAIRANG",3.9,,,,,
RIVER SUTLEJ AT LUDHIANA D/S,3.9,,,,,
"RIVER SABARMATI AT GANDHI NAGAR CHILODA BRIDGE, LEKAWADA,",3.9,,,,,
RIVER JHELAM AT CHATTABAL WEIR (OUTLET,3.9,,,,,
RAVI AT MADHOPUR,3.9,,,,,
"NEAR BRIDGE OVER DHANSIRI RIVER AT NH15, DHANSIRI",3.9,,,,,
"NARMADA AT SARSWATIGHAT, AFTER MIXING WITH BAWANGA",3.9,,,,,
MAHANADI U/S OF RAJIM,3.9,,,,,
"KRISHNA AT KRISHNA BRIDGE, KARAD, KARAD, SATARA",3.9,,,,,
KALINADI AT KANNAUJ (B/C),3.9,,,,,
"BAGMATI RIVER AT MUZAFFARPUR- SITAMARHI ROAD BRIDGE, SITAMARHI",3.9,,,,,
"SUTLEJ AT 100M D/S BUDHA NALA CONFL., LUDHIANA",3.883333333,,,,,
RIVER KABINI AT CAUSE WAY SATTUR,3.883333333,,,,,
"GODAVARI AT BHADRACHALAM D/S BATHING GHAT, KHAMMAM",3.878571429,,,,,
"GANGA D/S, MIRZAPUR",3.878571429,,,,,
"SONE AT AMLAI, 100 METRE D/S AFTER MIXING OF ATPS",3.875,,,,,
"RIVER KOHRA D/S NEAR RAILWAY BRIDGE, MAJHAULIA, WEST CHAMPARAN",3.875,,,,,
MAHI AT UMETA BRIDGE,3.87,,,,,
SINDH AT WAIL BRIDGE,3.866666667,,,,,
BATTA BEFORE CONFLUENCE TO YAMUNA,3.8625,,,,,
SUBAREKHA AT GHATISLA ROAD BRIDGE,3.85,,,,,
"SIKRAHNA RIVER AT LAUREA, HARINAGAR ROAD BRIDGE",3.85,,,,,
"RIVER KARIYARI U/S BEFORE MIXING WITH WASTE WATER OF M/S J.P. CEMENT , REWA",3.85,,,,,
RIVER KALINADI AT U/S OF MUZAFFAR NAGAR U.P.,3.85,,,,,
PURNA ON BRIDGE AT SURAT- NAVSARI HIGHWAY,3.85,,,,,
KSHIPRA AT SIDDHAWAT (D/S) OF UJJAIN,3.85,,,,,
KOLONG AT MARIGAON,3.85,,,,,
"GODAVARI AT BHADRACHALAM U/S BATHING GHAT, KHAMMAM",3.85,,,,,
DEEPAR BEEL,3.85,,,,,
"DAMODAR AT HOOGHLY, DURGACHAK, NEAR PATHIKALI",3.85,,,,,
"GANGA D/S, ANOOPSHAHAR",3.842857143,,,,,
PABBAR AT U/S DHAMBARI,3.83,,,,,
GANGA AT BUXAR,3.83,,,,,
"GODAVARI AT BURGAMPAHAD, KHAMMAM",3.828571429,,,,,
"RIVER PHE RESERVIOR (LAHMUN RIVER), MIZO VENG, MAMIT",3.825,,,,,
RIVER HINDON AT BARNAWA U/S,3.825,,,,,
PABBAR AT D/S SWARAKUDDU,3.825,,,,,
"CHUNT KOL * (MAULANA AZAD BRIDGE), JandK",3.825,,,,,
"RIVER NARMADA AT KAKRANA, INTERSTATE BOUNDRY, ALIRAJPUR",3.816666667,,,,,
"YAMUNA , D/S PAONTA SAHIB",3.8,,,,,
"WARDHA AT RAJURA BRIDGE,RAJURA, CHANDRAPUR, CHANDRAPUR",3.8,,,,,
"TAPI AT BHUSAWAL U/S, BHUSAWAL RAILWAY COLONY, BHUSAWAL, JALGAON",3.8,,,,,
"SUBARNAREKHA AT D/S JAMSHEDPUR, (TATA NAGAR), JHAR",3.8,,,,,
"SONE RIVER NEAR BANZARI, BIHAR",3.8,,,,,
"SONE AT WATER INTAKE POINT BHARTIYA RAIL BIJALI CO. LTD. (BRBCL), NAVINAGAR, AURANGABAD",3.8,,,,,
"SANO RU IN KOHIMA, NAGALAND",3.8,,,,,
"SABARMATI AT KHEROJ BRIDGE, GUJARAT",3.8,,,,,
"RIVER UMKHRAH AT MAWLAI, NEAR SLAUGHTER HOUSE",3.8,,,,,
"RIVER UJAD AT BHIM SAGAR DAM UPSTREAM , JHALAWAR, RAJASTHAN",3.8,,,,,
"RIVER SIANG AT RANAGHAT, NEAR RCC BRIDGE, PASIGHAT,",3.8,,,,,
RIVER NORTH KOEL U/S DALTANGANJ,3.8,,,,,
"RIVER MUSI BEFORE CONFLUENCE OF RIVER KRISHNA AT WADAPALLY (V), DAMARACHARLA (M), NALGONDA(D)",3.8,,,,,
RIVER KRISHNA AT WADAPALLY AFTER CONFL. WITH R. MUSI(SHIFTED FROM 1220),3.8,,,,,
RIVER JHELUM AT VERINAG,3.8,,,,,
RIVER IRIL AT KANGLA SIPHAI,3.8,,,,,
"RIVER GANGA D/S OF M/S NTPC, BARH WATER INTAKE POINT,PATHANICHAK, BINDTOLA BARH",3.8,,,,,
RIVER GANGA AT D/S BHAGALPUR NEAR BARARIGHAT,3.8,,,,,
"MYNTANG RIVER AT MYNSO, JAYANTIA HILLS",3.8,,,,,
"MAT RIVER, DAWN VILLAGE, NEAR MAT BRIDGE,LUNGLEI DIST.",3.8,,,,,
"MAHI AFTER CONF. WITH ANAS AT PARDI (BANASWADA),",3.8,,,,,
"GODAVARI RIVER AT KAPILA- GODAVARI CONFLUENCE POINT, TAPOVAN.",3.8,,,,,
GANDA NALLAH AT MARTHAPUR,3.8,,,,,
DIKHOW RIVER AT NAGINI MORA (INTERSTATE BOUNDARIE,3.8,,,,,
"DAMDIAI STREAM, AIRFIELD, NEAR TUIRIAL WASTE MANAGEMENT CENTRE, AIZAWL DIST",3.8,,,,,
"BINDUSARA RIVER AT BEED NEAR INTAKE WATER PUMP HOUSE AT DAM, PALIGAON, BEED, BEED",3.8,,,,,
"AMRAVATI RIVER D/S OF DONDAICHA, DHULE, DHULE",3.8,,,,,
"BANJAR AT MALANJKHAND NEAR W/S INTAKE POINT, JABALPUR",3.778571429,,,,,
WARDHA D/S OF ACC GHUGGUS.,3.775,,,,,
"PENNAR A/c WITH PAPAGNI, PUSPAGINI",3.775,,,,,
BETWA AT U/S NEAR ROAD BRIDGE ORCHHA,3.775,,,,,
"CAUVERY AT PITCHAVARAM, TAMILNADU",3.77,,,,,
NARMADA RIVER AT DHARAMPURI,3.7625,,,,,
WARDHA AT BANGON VILLAGE NEAR PANDHURNA (M.P.),3.75,,,,,
TAPI AT MANDAVI,3.75,,,,,
"SONE AT DEVLOAD OUT LET OF BANSAGAR DAM, M.P",3.75,,,,,
"RUPNARAYAN , D/S AT KOLAGHAT, NEAR KOLAGHAT RAIL BRIDGE NO.3",3.75,,,,,
RIVER TEESTA A/C WITH RANICHU AT SINGTAM,3.75,,,,,
"RIVER TAPI AT ONGC BRIDGE AT SURAT, DIST SURAT",3.75,,,,,
"RIVER SIANG AT RANAGHAT, NEAR RCC BRIDGE, PASIGHAT(U/S)",3.75,,,,,
"RIVER SEONATH AT U/S RAJNANDGAON,",3.75,,,,,
"RIVER MULA AT AUNDH BRIDGE, AUNDHGAON, HAWELI, PUNE",3.75,,,,,
RIVER KRISHNA AT D/S OF ALAMATTI DAM,3.75,,,,,
"RIVER DAMODAR AT WATER INTAKE POINT FOR BURDWAN TOWN, BURDWAN",3.75,,,,,
"RIVER ALI SAGAR RESERVIOR PROJECT AREA, ALISAGAR (V) YEDAPALLY (M) NIZAMABAD DIST.",3.75,,,,,
"PAWANA RIVER AT RAVET WEIR, RAVET, HAWELI, PUNE",3.75,,,,,
NARMADA NEAR SOURCE AT AMARKANTAK M.P.,3.75,,,,,
"MUTHA RIVER AT KHADAKVASLA DAM, VILLAGE KHADAKVASLA,TALUKA HAWELI, DISTRICT PUNE.",3.75,,,,,
MULA RIVER AT HARRISON BDG NEAR MULA- PAWANA SANGAM.,3.75,,,,,
"MAHANADI AT TIKARPADA, ORISSA",3.75,,,,,
"KATHAJODI AT CUTTACK D/S, ORISSA",3.75,,,,,
"GANDAK AT ROAD BRIDGE, U/S HAJIPUR",3.75,,,,,
"BRAHMANI AT ROURKELA D/S, ORISSA",3.75,,,,,
"BHIMA RIVER AT D/S OF BUNDGARDEN, VILLAGE YERWADA,TALUKA HAWELI, DISTRICT PUNE.",3.75,,,,,
"AMARAVATI , GUNTUR DIST",3.75,,,,,
MANJEERA AT GOWDICHARLA B/C WITH NAKKAVAGU,3.74,,,,,
RIVER JUMAR AT KANKE DAM,3.733333333,,,,,
ALAKNANDA A/C MANDAKINI AT RUDRAPRAYAG,3.733333333,,,,,
KRISHNA AT GADWAL BRIDGE,3.73,,,,,
"PARVATI BEFORE CONF. TO RIVER BEAS, H.P.",3.716666667,,,,,
"D/S OF KANSI AT MIDNAPORE, NEAR NEW HANUMAN MANDIR, GANDHIGHAT",3.716666667,,,,,
NARMADA RIVER AT D/S OF KAPILDHARA,3.7125,,,,,
"NARMADA AT ZANOR (NTPC), BHARUCH",3.707142857,,,,,
"TUNGHABHADRA AT KURNOOL U/S, BAVAPURAM, A.P.",3.7,,,,,
TAWI AT BELOW TAWI BRIDGE,3.7,,,,,
SUTLEJ AT D/S BHAKHRA,3.7,,,,,
"SONE RIVER AT NASIRIGANJ DAM, BIHAR",3.7,,,,,
SINDH RIVER AT SONAMARG U/S,3.7,,,,,
"RIVER BEAS D/S NADAUN BRIDGE, VILL BHADOLI",3.7,,,,,
"PENNAR AFTER CONF. WITH PAPAGNI, PUSPAGINI, A.P.",3.7,,,,,
"PENNAR AFTER CONF. WITH CHEYYURU, SOMASILE, A.P.",3.7,,,,,
"MANJEERA RIVER - NEAR GANAPATHI SUGARS , MEDAK DIST.",3.7,,,,,
KARIYARI U/S BEFORE MIXING WITH WASTE WATER OF M/S,3.7,,,,,
"IB AT RAJ NAGAR U/S, ORISSA",3.7,,,,,
"GODAVARI AT U/S OF GANGAPUR DAM, NASHIK",3.7,,,,,
"DARNA RIVER AT BHAGUR PUMPING STATION NEAR PANDHURLI BRIDGE, VILLAGE BHAGUR,TALUKA NASHIK,DISTRICT NASHIK.",3.7,,,,,
CAUVERY AT THIRUMUKKUDAL-CONFL. PT.OF R. AMRAVATI,3.7,,,,,
"BORI RIVER D/S OF AMALNER, JALGAON, JALGAON",3.7,,,,,
BANGANGA (IN FRONT OF PONY SHED NEAR REASI BRIDGE),3.7,,,,,
"SUTLEJ AT D/S EAST BEIN, PUNJAB",3.675,,,,,
RIVER WAIKHRWI AT MOOPALA,3.675,,,,,
"RIVER RAPTI AFTER CONFL. OF R. HONIN NR. DOMINGARH RLY BRIDGE, GORAKHPUR, U.P.",3.675,,,,,
"CAUVERY AT NAPOKULU BDG (D/S), KARNATAKA",3.675,,,,,
"BHIMA AFTER CONF. WITH DAUNT, MAHARASHTRA",3.675,,,,,
KHANDITARA (D/S OF INDUSTRIAL ACTIVITIES AT KALINGA NAGAR),3.666666667,,,,,
"RIVER NARMADA LALPUR, JABALPUR",3.6625,,,,,
ALAKNANDA A/C WITH BHAGIRATHI AT DEVPRAYAG,3.6625,,,,,
"WENA RIVER AT U/S OF MOHATA MILLS, NEAR RAILWAY BRIDGE, HINGANGHAT, WARDHA",3.65,,,,,
SHANKNI A/C DANKANI DANTEWADA,3.65,,,,,
RIVER SUTLEJ U/S IANDFILL SITE RAMPUR,3.65,,,,,
"RIVER KANHAN D/S OF NAGPUR, AGARGAON, KUHI, NAGPUR",3.65,,,,,
RIVER JHELAM AT ANANTNAG D/S,3.65,,,,,
MINDHOLA AT STATE HIGHWAY BRIDGE SACHIN,3.65,,,,,
"KANSI, D/S MIDNAPORE, NEAR NEW HANUMAN MANDIR, GANDHIGHAT",3.65,,,,,
IB AT RAJ NAGAR U/S,3.65,,,,,
"HINDON AT SAHARANPUR D/S, U.P.",3.65,,,,,
GODAVARI RIVER AT D/S OF PAITHAN AT PATHEGAON BRIDGE.,3.65,,,,,
"CHENAB AT JAL PATAN MANDIR AFTER MEETING WITH MAIN DRAIN OF AKHNOOR CITY(1.5 KMD/S FROM SPOT,JandK",3.65,,,,,
"CAUVERY AT URRACHIKOTTAI, ERODE",3.65,,,,,
KATNI RIVER NEAR NAGAR NIGAM,3.64,,,,,
RIVER ADYAR AT JAFERKHANPET,3.633333333,,,,,
MANGALA AT PURI D/s GOLASAHI,3.633333333,,,,,
RIVER NALKARI TRIBUTARY AT PATRATU,3.625,,,,,
RIVER TOCKLAI NEAR BRIDGE AT JORHAT,3.616666667,,,,,
"RIVER DAMODAR AT DURGAPUR U/S, BURDWAN",3.61,,,,,
"WAINGANGA AT ASHTI,GONDPIPRI, CHANDRAPUR",3.6,,,,,
"SABARMATI AT RAILWAY BRIDGE AHMEDABAD, GUJARAT",3.6,,,,,
"RIVER WARDHA AT D/S OF ERAI RIVER AT HADASTI NEAR ARUN ENGG. WORKS, VILLAGE- HADASTI, TALUKA- CHANDRAPUR,",3.6,,,,,
"RIVER UMTREW AT UMRAN,",3.6,,,,,
"RIVER TAPI AT UKAI, SHERULA BRIDGE",3.6,,,,,
RIVER HASDEO AT U/S OF CHAMPA CHHATTISGARH,3.6,,,,,
"RIVER GIRI D/S KALGIDHAR TRUST, BARU SAHIB",3.6,,,,,
"RIVER GANGA, JHAJGHAT AT KAHALGAON",3.6,,,,,
"RIVER GANGA AT KANPUR D/S (JANA VILLAGE), U.P",3.6,,,,,
RIVER GANGA AT D/S SHUKLAGANJ,3.6,,,,,
"RIVER DHOS AT MADHWAPUR, MADHUBANI",3.6,,,,,
RIVER BEAS AT EXIT OF DEHAR POWER HOUSE,3.6,,,,,
"PEDHI RIVER NEAR ROAD BRIDGE AT DADHI-PEDHI VILLAGE, BHATKULI, AMRAVATI",3.6,,,,,
"MAHI (D/S) CONF WITH R. CHAP (UNDER SAGWARA- SARHI RD. BDG.), RAJASTHAN",3.6,,,,,
MAHANADI AT PARADEEPD/S,3.6,,,,,
"LIDDER NERA BUMZOO, ANANTNAG",3.6,,,,,
"KRISHNA D/S OF ISLAMPUR, WALWA, SANGLI",3.6,,,,,
"KRISHNA AT U/S OF UGARKHURD BARRAGE, KARNATAKA",3.6,,,,,
IB AT BRAJRAJNAGAR D/S,3.6,,,,,
GOMTI AT SITAPUR U/S AT WATER INTAKE,3.6,,,,,
"GOMTI AT LUCKNOW D/S,",3.6,,,,,
"GODAVARI RIVER AT NANDUR MADMESHWAR DAM, NANDUR, NASHIK",3.6,,,,,
"GANGA AT VARANASI D/S (MALVIYA BRIDGE), U.P",3.6,,,,,
GANGA AT TARIGHAT GHAZIPUR (U.P.),3.6,,,,,
GANGA AT DALMAU (RAI BAREILLY),3.6,,,,,
"DHANSIRI AT NAGALAND- ASSAM BORDER, DIMAPUR",3.6,,,,,
DAMODAR AT DOMGARH WATER WORKS D/S SINDRI,3.6,,,,,
CHAMPANAGAR,3.6,,,,,
"CHAMBAL AT JAWNPAWA, FROM ORIGIN POINT, INDORE",3.6,,,,,
BHAVANI AT SIRUMUGAI,3.6,,,,,
"TITUR RIVER, D/S OF CHALISGAON, JALGOAN.",3.591666667,,,,,
BHADRA AT MALLESWARAM D/S OF KIOCL,3.5875,,,,,
"TAPI AT MANDAVI, GUJARAT",3.575,,,,,
"RIVER WAH BLEI AT SDAD DKHAR,",3.575,,,,,
RIVER KAGINA AT SHAHABAD BRIDGE,3.575,,,,,
RIVER GANGA AT HAR KI PAURI GHAT,3.575,,,,,
"GODAVARI AT MANCHERIAL, NEAR RLY BDG B/C OF RALLAVAGU",3.575,,,,,
"GANGA AT DAKSHMINESHWAR, KOLKATA, WEST BENGAL",3.575,,,,,
"CHHIMTUIPUI RIVER, KAWLCHAW, NEAR CHHIMTUPUI BRIDGE, SAIHA DIST.",3.575,,,,,
BOKARO AT ZARANGDIH BRIDGE,3.575,,,,,
"RIVER NARMADA AT PANCHWATIGHAT, BEFORE MIXING WITH BAWANGANGA RIVER, JABALPUR",3.566666667,,,,,
"DHANSIRI AT NAGALAND ASSAM BORDER, DIMAPUR",3.566666667,,,,,
"MULA-MUTHA RIVER AT D/S OF THEUR, HAWELI, PUNE",3.5625,,,,,
YAGACHI NEAR PUMPING STATION. HASSAN CITY,3.55,,,,,
"SUBARNAREKHA AT JAMSHEDPUR, JHARKHAND",3.55,,,,,
"RIVER WAINGANGA U/S OF GAURAV PAPER MILLS, NEAR JACKWELL, BRAMHPURI, CHANDRAPUR",3.55,,,,,
"RIVER PURNA AT D/S OF CONFLUENCE OF MORNA and PURNA RIVER AT ANDURA VILLAGE, VILLAGE-ANDURA, TALUKA- BALAPUR, DISTRICT - AKOLA.",3.55,,,,,
"RIVER PARVATI NEAR INTAKE POINT PILLUKHEDI DISTT. RAJGARH, M.P",3.55,,,,,
RIVER MALPRABHA AT D/S OF KHANAPUR VILLAGE,3.55,,,,,
RIVER DHAMRA AT DHAMRA,3.55,,,,,
